title,url,author_name,word_count,body
Mengukir nama di puncak dunia,https://www.hmetro.com.my/utama/2024/08/1124044/mengukir-nama-di-puncak-dunia,Muhammad Saufi Hassan,342,"Kuala Lumpur: Anak muda ini pernah menawan puncak Gunung Everest, menjelajah tujuh benua serta kutub utara dan selatan, sekali gus mengharumkan nama negara di pentas dunia. Walaupun berdepan pelbagai rintangan dalam misi membawa nama negara, namun anak muda ini tidak pernah mengalah serta membuktikan segalanya mampu dicapai dengan usaha keras. Anak muda berkenaan, Datuk Muhamad Muqharabbin Mokhtarrudin atau lebih selesa dengan panggilan Qobin percaya bahawa semua anak tempatan mampu menempa nama di pentas dunia dengan usaha keras. Qobin berkata, beliau tidak pernah menyangka mampu menawan puncak tertinggi dunia serta melakukan pelbagai ekspedisi untuk membawa nama negara. ""Ketika itu, saya hanya berusaha keras untuk membawa nama negara dan berbakti, Alhamdulillah saya amat gembira misi penjelajahan yang dilaksanakan sebelum ini berjaya mencapai matlamatnya. ""Jika menyentuh mengenai rintangan, ia memang banyak, namun kita perlu terus berusaha keras kerana setiap usaha itu pastinya akan membuahkan hasil. ""Sebelum menjejakkan kaki dipuncak Everest, tujuh benua dan penjelajahan ke kutub utara dan selatan, memang ada banyak rintangan yang datang,"" katanya.  Menceritakan semula pengalamannya, Qobin berkata, ketika misi menawan Gunung Everest, sokongan Universiti Teknologi Mara (UiTM) dan Kementerian Belia dan Sukan (KBS) banyak membantu dalam merealisasikan impian. ""Selepas itu, saya menggunakan 80 peratus dana sendiri mendaki ke tujuh benua dan dua kutub. ""Impian ketika itu direalisasikan dengan kerjasama beberapa penaja swasta dalam bentuk barangan, pengangkutan dan peralatan ekspedisi. ""Rintangan cuaca dengan suhu ekstrem negatif 30 darjah Celcius dan perjalanan yang panjang setiap hari amat-amat menguji kekuatan fizikal dan mental di setiap ekspedisi yang dilalui,"" katanya.  Beliau berkata, semua rakyat negara ini perlu mempunyai impian melebihi apa yang diinginkan sekali gus, ia akan mendorong seseorang untuk terus berjaya. Menurutnya, generasi muda pada hari ini perlu fokus dengan impian mereka serta mempunyai disiplin diri yang sangat tinggi. ""Saya yakin semua anak tempatan mampu berjaya di persada dunia jika kita ada keyakinan, minat, disiplin dan menjauhi perkara yang tidak berfaedah. ""Sejujurnya, saya bangga menjadi anak Malaysia, ini   negara yang unik dengan pelbagai bangsa serta agama, tetapi kita tetap bersatu di bawah satu panji negara,"" katanya."
Kata-kata bertukar jadi nista,https://www.hmetro.com.my/utama/2024/08/1124039/kata-kata-bertukar-jadi-nista,Nor Asyikin Mat Hayin,956,"Kecoh di media sosial baru-baru ini mengenai tindakan netizen menyerang akaun media sosial pelumba Jepun Shinji Nakano selepas insiden pelanggaran dengan Shah Firdaus Sahrom dalam aksi final keirin pada Sukan Olimpik.Ia menjadi satu lagi episod buli siber di negara ini yang dilihat semakin merebak dan memberikan kesan yang sangat buruk.Laporan Tabung Kanak-Kanak Pertubuhan Bangsa-Bangsa Bersatu (Unicef) mendedahkan Malaysia berada kedudukan kedua di Asia pada 2020 bagi perbuatan buli siber dalam kalangan belia.Ikuti wawancara wartawan NOR 'ASYIKIN MAT HAYIN bersama Penyelidik dan Pensyarah Kanan Keselamatan Maklumat Universiti Putra Malaysia (UPM), DR MUHAMMAD DANIEL HAFIZ ABDULLAH untuk Kafe Ahad minggu ini.Apakah pandangan Dr mengenai buli siber di negara ini?Di Malaysia, buli siber adalah satu isu yang semakin membimbangkan terutama dengan peningkatan penggunaan media sosial dan platform digital.Malah, kesan buli siber di Malaysia juga agak meresahkan terutama dalam kalangan golongan muda. Ini kerana ianya dikaitkan dengan masalah kesihatan mental seperti kemurungan dan ada beberapa kes yang menyumbang kepada kejadian bunuh diri. Stigma budaya terhadap kesihatan mental di Malaysia juga boleh menyukarkan mangsa untuk mendapatkan bantuan yang seterusnya memburukkan lagi masalah ini.Kerajaan dan pelbagai organisasi sudah mengambil langkah untuk menangani masalah buli siber seperti melaksanakan undang-undang menerusi Akta Komunikasi dan Multimedia 1998 yang merangkumi peruntukan bagi menghukum pelaku buli siber.Walau bagaimanapun, penguatkuasaan semakin mencabar dan undang-undang sahaja tidak mencukupi untuk membendung masalah ini. Secara keseluruhannya, walaupun Malaysia sudah membuat kemajuan dalam menangani buli siber, namun masih banyak lagi perlu dilakukan. Apa yang mendorong seseorang individu terdorong menjadi pembuli siber?Individu terdorong untuk menjadi pembuli siber disebabkan oleh beberapa faktor psikologi, sosial dan persekitaran.Antaranya adalah rasa anonimiti yang wujud di internet yang mana mereka merasa kurang bertanggungjawab atas tindakannya disebabkan boleh menyembunyikan identitinya.Rasa kuasa dan kawalan juga adalah faktornya yang mana mereka merasa hebat atau puas apabila dapat membuli orang lain. Pengaruh rakan sebaya turut memainkan peranan penting yang mana sesetengah individu membuli kerana mahu diterima dalam kumpulan atau untuk mengelakkan diri mereka sendiri daripada menjadi mangsa. Kekurangan empati terutamanya dalam komunikasi di talian yang tidak membabitkan interaksi bersemuka, turut boleh menyebabkan mereka kurang memahami akan kesakitan mental dan emosi ditanggung mangsa. Selain itu, berkemungkinan juga yang membuli ini disebabkan mahu membalas dendam, hiburan atau sekadar melepaskan kekecewaan atau kemarahan. Setiap kali musim sukan, pembuli siber agresif menyerang media sosial atlet asing, jika berlaku insiden atlet Malaysia tewas. Boleh komen?Peningkatan trend buli siber terhadap atlet asing terutama apabila atlet Malaysia gagal memenangi pingat adalah sesuatu yang sangat membimbangkan. Tingkah laku seperti ini bukan saja mencerminkan nilai kurang baik, tetapi juga bertentangan dengan prinsip kesukanan yang sepatutnya kita hormati.Pertama, adalah difahami bahawa sukan membangkitkan emosi yang kuat terutamanya apabila membabitkan maruah negara. Namun, ini tidak boleh dijadikan alasan untuk mengganggu atau menyakiti atlet dari negara lain. Tindakan sebegini boleh membawa kesan psikologi yang serius kepada mangsa dan mencemarkan imej baik Malaysia di peringkat antarabangsa.Kedua, kita perlu menyedari bahawa setiap atlet tanpa mengira kewarganegaraan berhak untuk dihormati atas usaha dan dedikasi mereka. Menyerang mereka di media sosial hanya akan menyebarkan aura negatif dan boleh merosakkan hubungan antarabangsa. Kita harus belajar untuk menerima kekalahan dengan hati terbuka dan menghargai usaha dilakukan. Bukannya melepaskan kemarahan dengan cara tidak beretika.Agak memalukan kerana pembuli siber seperti hilang pertimbangan kerana menggunakan ayat dan emoji kurang sopan, selain menyentuh keluarga atlet luar. Apa pandangan Dr?Buli siber sering kali berpunca daripada rasa kurang tanggungjawab dan ketidakpedulian yang wujud dalam kalangan pembuli di ruang siber. Pembuli ini cenderung hilang pertimbangan kerana mereka merasakan boleh bertindak sesuka hati tanpa perlu menghadapi akibat secara langsung. Penggunaan ayat kurang sopan, emoji menyakitkan hati dan serangan terhadap keluarga mangsa adalah sangat serius, yang mana boleh membawa kesan lebih teruk seperti gangguan emosi berpanjangan serta kemurungan.Kesan penyahrencatan (disinhibition effect) yang mana seseorang berasa kurang terikat dengan norma sosial dalam interaksi siber berbanding interaksi bersemuka turut menyumbang  kelakuan ini.Ia bukan saja melanggar batasan peribadi tetapi juga meningkatkan perasaan terancam pada diri mangsa. Pengalaman ini boleh menjadi lebih trauma dan membawa kesan psikologi yang berkekalan seperti kemurungan serta rasa tidak berdaya.Untuk menangani masalah ini, perlu ada pendekatan yang pelbagai termasuk mempromosikan empati digital, menguatkuasakan peraturan lebih ketat terhadap tingkah laku dalam talian dan mendidik pembuli serta mangsa mengenai akibat serius buli siber. Dalam kes berkaitan sukan, apa sebenarnya dimahukan pembuli siber mahu daripada atlet luar yang dibuli?Kemarahan atau kekecewaan:Pembuli siber sering kali bertindak atas dorongan emosi negatif seperti marah atau kecewa. Dalam kes sukan terutamanya apabila atlet atau pasukan kegemaran mereka tidak mencapai prestasi yang diharapkan, pembuli siber mungkin melepaskan kekecewaan mereka terhadap orang lain termasuk lawan atau pihak yang dianggap bertanggungjawab.Menuntut pengakuan kesilapan:Dalam budaya tertentu, ada tekanan sosial untuk memohon maaf apabila seseorang dilihat sebagai 'melanggar norma' atau menyebabkan kekecewaan. Pembuli siber mungkin menekan mangsa supaya memohon maaf atau mengaku salah walaupun kesalahan itu tidak jelas atau signifikan.Kepuasan emosi:Sesetengah pembuli siber mungkin merasakan kepuasan atau kepuasan sementara dengan melihat orang lain terganggu, tertekan atau meminta maaf. Tindakan ini memberi mereka rasa kuasa atau kawalan.Menguatkan identiti kolektif:Dalam kes seperti serangan terhadap pelumba basikal trek Jepun, Shinji Nakano, pembuli siber mungkin berasa mempertahankan maruah atau reputasi negara atau pasukan mereka. Selain itu, mungkin menganggap bahawa dengan menyerang orang yang dirasakan sebagai 'musuh' atau 'pesaing,' sebagai tanda menyokong pasukan atau negara mereka.Pengiktirafan:Ada kalanya, pembuli siber mahu dilihat atau didengar. Dengan menyerang secara dalam talian, mereka mungkin merasakan sedang menarik perhatian orang lain atau mendapatkan sokongan daripada kelompok yang berfikiran sama.Oleh itu, dalam kes Shinji Nakano, tekanan untuk meminta maaf mungkin berpunca daripada kombinasi beberapa faktor di atas. Pembuli siber mungkin merasakan permohonan maaf akan memulihkan rasa maruah atau kepuasan mereka walaupun ia bukanlah cara sihat untuk menangani kekecewaan."
Bersaing menangi undi di 50 negeri,https://www.hmetro.com.my/utama/2024/08/1124025/bersaing-menangi-undi-di-50-negeri,Agensi,330,"Rakyat Amerika Syarikat (AS) akan mengundi pada November depan bagi memilih presiden mereka seterusnya.Berikut adalah fakta mengenai pilihan raya yang menarik perhatian dunia ini, seperti yang dirumuskan oleh BBC.Bilakah tarikh Pilihan Raya Presiden? Ia akan diadakan pada Selasa (5 November 2024). Calon yang menang akan berkhidmat selama empat tahun di Rumah Putih, bermula pada Januari 2025.Siapa calon dan bagaimana mereka dicalonkan?Kedua-dua parti utama mencalonkan calon presiden dengan mengadakan beberapa siri undi yang dipanggil pemilihan utama dan kaukus negeri, di mana orang ramai memilih siapa yang mereka mahu memimpin parti.Parti Republikan akan diwakili bekas Presiden Donald Trump. Calon Parti Demokratik adalah Naib Presiden Kamala Harris yang dipilih partinya selepas Joe Biden mengundurkan diri.  Terdapat juga beberapa calon bebas bertanding jawatan presiden, termasuk Robert F Kennedy Jr iaitu anak saudara kepada bekas presiden John F Kennedy.Apa itu Demokrat dan Republikan?Demokrat atau Parti Demokratik adalah parti politik liberal, dengan agenda yang ditakrifkan sebahagian besarnya oleh desakan hak sivil, jaringan keselamatan sosial yang luas dan langkah-langkah untuk menangani perubahan iklim.Parti Republikan adalah parti politik konservatif di AS. Ia juga dikenali sebagai GOP atau Grand Old Party yang mewakili hasrat untuk cukai yang lebih rendah, mengecilkan saiz kerajaan, hak senjata api dan sekatan yang lebih ketat ke atas imigresen dan pengguguran bayi.Bagaimana perjalanan Pilihan Raya Presiden AS?Pemenang bukan orang yang mendapat undian terbanyak di seluruh negara. Sebaliknya, kedua-dua calon bersaing untuk memenangi pertandingan di 50 negeri.Setiap negeri mempunyai bilangan undi kolej elektoral yang sebahagiannya berdasarkan populasi di setiap negeri. Terdapat 538 undi kolej elektoral dan pemenangnya ialah calon yang memenangi 270 atau lebih undi itu.Semua - kecuali dua negeri - mempunyai peraturan pemenang-ambil-semua (winner-takes-all), jadi mana-mana calon yang memenangi jumlah undian tertinggi akan diberikan semua jumlah undi kolej elektoral untuk negeri berkenaan.Bilakah kita tahu siapa pemenang?Biasanya pemenang diumumkan pada malam pilihan raya, tetapi pada 2020, kiraan undi mengambil masa beberapa hari.Presiden secara rasminya akan mengangkat sumpah memegang jawatan itu pada Januari di bangunan Capitol di Washington DC."
Harmoni 28 tahun,https://www.hmetro.com.my/utama/2024/08/1123997/harmoni-28-tahun,Norhayati Nordin,568,"JENAMA Senario sebagai kumpulan lawak terkenal di Malaysia sudah dibuktikan mereka menerusi pengiktirafan Pencapaian Sepanjang Zaman di Anugerah Lawak Warna pada 2014 iaitu 10 tahun lalu.Semua anggota Senario yang bakat mereka dicungkil dalam pertandingan Sinaran Passport Kegemilangan di TV3 pada 1990-an hingga kini masih diingati ramai walaupun berpuluh tahun sudah berlalu.Selain melawak, Senario dianggotai Azlee Jaafar, Wahid, Lan Pet Pet, Illya (Pak Ya), Allahyarham Hamdan, Saiful Apek dan Yassin Yahya turut dikenali sebagai pelakon dan penyanyi apabila pernah membintangi filem dan menghasilkan album.Persahabatan erat selama 28 tahun sejak Senario mula ditubuhkan pada 1996 disifatkan ikatan bermakna kerana selama tempoh itu mereka tidak pernah bergaduh besar sesama sendiri hingga bermasam muka.Azlee berkata, perselisihan faham berkaitan pendapat memang berlaku kerana mereka bekerja secara berkumpulan yang ada banyak kepala dan berlainan idea. Tetapi, tidaklah mengheret sampai berpanjangan.""Alhamdulillah, selama 28 tahun Senario bersahabat dari dulu hingga sekarang, kami semua tak pernah bermasam muka. Memang kadang-kadang ada berlaku perselisihan faham, namun ia diselesaikan segera.""Ini kerana, kami (Senario) tidak mahu masalah yang berlaku itu mempengaruhi dan boleh mengganggu 'mood' untuk menghiburkan penonton. Sebabnya, peminat datang menonton kami untuk bergembira,"" katanya.Menurut Azlee, dia bersyukur Senario masih diterima baik masyarakat apabila mendapat tawaran nyanyian iaitu Showcase Senariounion yang bakal berlangsung di Panggung Bangsawan Melaka 31 Ogos ini.Ditanya mengenai jualan tiket, Apek pula berkata, Senario sudah terbabit dalam beberapa 'showcase' berbayar sebelum ini dan sambutan diterima amat memberangsangkan.""Alhamdulillah, kami terima sambutan meriah ketika 'show' di Kota Bharu, Kelantan baru-baru ini. Jadi untuk di Melaka nanti, kami berbesar hati cuba penuhi permintaan peminat dan buktikan Senario masih ada.""Cuma, munculnya kami (Senario) bukan untuk bersaing dengan orang baharu dan muda, tetapi lebih kepada melepaskan kerinduan buat peminat kami yang masih setia menyokong Senario dari dulu sampai sekarang.""Bukan itu saja, kami ambil peluang ini untuk buktikan kepada peminat ukhwah Senario tetap erat sebab kami tengok dalam industri sekarang, ramai yang berpecah belah,"" katanya memberitahu 'show' itu juga adalah penghargaan buat Allahyarham Hamdan.Menurut Apek, dia berharap ramai hadir menyokong Senario untuk mengimbau kembali nostalgia indah terutama ketika Hamdan masih ada kerana banyak menjayakan konsert bersama. Difahamkan, penjualan tiket untuk menyaksikan Showcase Senariounion setakat ini sudah terjual lebih 60 peratus dan cukup positif berikutan jumlah dewan boleh memuatkan penonton lebih 350 orang.Yassin sebagai 'tauke acara'Berpengalaman 20 tahun dalam penganjuran acara, Yassin menerusi syarikatnya, Yasstar Empire mengambil inisiatif sebagai 'tauke acara' untuk Showcase Senariounion kerana berasakan peluang itu wajar buat Senario.""Semuanya bermula beberapa bulan lalu ketika saya menjadi pengacara dalam satu program di Panggung Bangsawan Melaka. Saya dapati menarik juga kalau Senario boleh buat 'show' di situ hiburkan pengunjung.""Jadi, saya pun berjumpa dengan Pengurus Besar Panggung Bangsawan, Datin Sukhirah Ibrahim bagi menyuarakan idea serta berbincang mengadakan 'show' Senario dan Alhamdulillah, ia diterima baik.""Namun saya nekad dalam hati memastikan Showcase Senariounion ini akan kita bawa abang Lan Pet Pet turut sama kerana percaya ramai peminat menantikan kemunculannya bersama Senario lagi,"" katanya.Yassin berkata, dia gembira kerana Lan tidak menolak cadangan itu serta berminat menyertainya yang disifatkan begitu istimewa apabila semua anggota Senario dapat dikumpulkan bersama.""Saya memang hormati keputusan abang Lan meninggalkan Senario sebelum ini untuk dia menceburi bidang lain. Itu hak masing-masing dan sebagai sahabat kita beri sokongan tidak berbelah bahagi,"" katanya.Showcase Senariounion dijangka berlangsung dua jam dengan enam lagu bakal dinyanyikan berserta hiburan lawak jenaka santai dan spontan daripada Senario yang cukup dikenali dengan persembahan lawak tersendiri."
"Lebih 40,000 penonton hadir perasmian pembukaan Sukma Sarawak",https://www.hmetro.com.my/utama/2024/08/1123965/lebih-40000-penonton-hadir-perasmian-pembukaan-sukma-sarawak,Syazwan Msar dan Mohd Roji Kawi,328,"Kuching: Paluan gendang Sukan Malaysia (Sukma) Sarawak 2024 sudah pun bermula sebaik saja temasya itu membuka tirai secara rasmi sambil disaksikan lebih 40,000 penonton membanjiri Stadium Sarawak, malam ini.  Walaupun acara perasmian membuka tirainya jam 7 petang namun orang ramai sudah mula membanjiri perkarangan Stadium Sarawak sejak jam 3 petang demi memastikan tidak terlepas peluang untuk menyaksikan majlis perasmian yang penuh gilang-gemilang itu.  Tetamu yang hadir disajikan dengan pertunjukan  memukau terutamanya persembahan tarian daripada pelbagai etnik selain pertunjukan cahaya yang akan menjadi antara elemen kejutan buat pengunjung.  Kemeriahan majlis perasmian diserikan dengan kehadiran Yang Dipertua Negeri Sarawak, Tun Dr Wan Junaidi Tuanku Jaafar dan Premier Sarawak Tan Sri Abang Johari Tun Openg.  Kepimpinan kerajaan yang turut hadir adalah Timbalan Perdana Menteri Datuk Seri Fadillah Yusof bersama isterinya.  Malah, Menteri Belia dan Sukan Hannah Yeoh dan Timbalannya Adam Adli Abdul Halim juga tidak mahu mahu terlepas peluang untuk bersama dengan rakyat Bumi Kenyalang menyaksikan upacara perasmian itu.  Penonton turut dihiburkan dengan persembahan daripada barisan artis terkenal tanah air antaranya Jaclyn Victor, Faizal Tahir, Marsha Milan dan Bob Yusof.  Seperti biasa perarakan kontinjen akan berlangsung sebelum ucapan tetamu kehormat dengan dimulakan Johor selaku juara Sukma 2022 dan diakhiri wakil daripada tuan rumah.  Namun, kelainan yang ditampilkan pada kali ini adalah penganjur menghimpunkan atlet terkemuka dari Bumi Kenyalang membabitkan legenda pecut Watson Nyambek, bekas perenang negara Daniel Bego dan juga barisan penerjun seperti Bryan Nickson Lomas, Traisy Vivien Tukiet, Datuk Pandelela Rinong dan  Bertrand Rhodict Lises yang baru pulang dari Sukan Olimpik Paris 2024.  Pandelela dan peninju sensasi Sarawak, Daeloniel McDelon Bong atau lebih dikenali sebagai 'Kilat Boy' diberikan penghormatan untuk membawa obor temasya dwi tahunan itu.    Mengikut rekod, kali pertama Sarawak menganjurkan Sukma adalah pada 1990 manakala penganjuran terakhir lapan tahun lalu.  Sukma Sarawak dianjurkan di sembilan bahagian di Sarawak hingga 24 Ogos membabitkan 488 acara dalam 37 jenis sukan terdiri daripada 236 acara lelaki, 217 wanita dan 35 acara campuran.  Penganjuran kali ini bertemakan Matlamat Perpaduan Membara iaitu menekankan kesepakatan dan masyarakat majmuk walaupun terdiri daripada latar belakang berbeza."
Mohd Azmawi Fikri rasmi menang PRK Dun Nenggiri,https://www.hmetro.com.my/utama/2024/08/1123953/mohd-azmawi-fikri-rasmi-menang-prk-dun-nenggiri,Nor Fazlina Abdul Rahim,233,"Gua Musang: Calon Barisan Nasional (BN), Mohd Azmawi Fikri Abdul Ghani menewaskan calon Bersatu mewakili Perikatan Nasional (PN), Mohd Rizwadi Ismail sekali gus menawan semula kerusi Dewan Undangan Negeri (Dun) Nenggiri, pada Pilihan Raya Kecil (PRK), hari ini. Pegawai Pengurus Pilihan Raya PRK Dun Nenggiri, Nik Raisnan Daud mengumumkan kemenangan Mohd Azmawi Fikri di Pusat Penjumlahan Rasmi Undi di Dewan Kompleks Perdana, Majlis Daerah Gua Musang pada 9.30 malam.Mohd Azmawi Fikri, 38, memperoleh 9,091 undi menewaskan pencabarnya Mohd Rizwadi yang meraih 5,739 undi. Ketua Pemuda Umno Kelantan dan Gua Musang yang mesra dengan panggilan Awie menang dengan majoriti 3,352 undi, membolehkan parti itu merampas kembali kerusi berkenaan yang sebelum ini disandang oleh Mohd Azizi Abu Naim.Keputusan rasmi itu diperoleh selepas kiraan semua 46 saluran peti undi di 20 Pusat Daerah Mengundi (PDM) dan sebanyak 135 kertas undi ditolak.Berdasarkan keputusan kiraan, BN memenangi 17 daripada 20 pusat daerah mengundi (PDM), manakala PN pula hanya menguasai tiga PDM.PRK Dun Nenggiri menyaksikan pertembungan satu lawan satu antara Mohd Azmawi mewakili Kerajaan Perpaduan dan Mohd Rizwadi  mewakili PN.Ia diadakan berikutan kekosongan kerusi yang diumumkan Speaker Dun Kelantan Datuk Mohd Amar Nik Abdullah pada 19 Jun lalu, selepas bekas penyandangnya Mohd Azizi Abu Naim digugurkan keahlian oleh Bersatu pada 13 Jun.Pada Pilihan Raya Negeri (PRN) Kelantan, Ogos tahun lalu, calon BN, Ab Aziz Yusoff tewas kepada Mohd Azizi yang bertanding di bawah tiket PAS mewakili PN, dengan majoriti 810 undi."
"PRK Dun Nenggiri: Kira undi selesai, BN menang besar",https://www.hmetro.com.my/utama/2024/08/1123923/prk-dun-nenggiri-kira-undi-selesai-bn-menang-besar,Nor Fazlina Abdul Rahim,191,"Gua Musang: Semua 20 pusat daerah mengundi (PDM) Pilihan Raya Kecil (PRK) Dewan Undangan Negeri (Dun) Nenggiri selesai menjalani proses pengiraan undi pada 8.12 malam tadi. Daripada jumlah itu 17 PDM dimenangi Barisan Nasional (BN) menerusi calonnya Mohd Azmawi Fikri Abdul Ghani, manakala tiga PDM dimenangi PAS. Secara tidak rasmi, Mohd Azmawi memenangi kerusi Dun itu selepas memperoleh 9,112 undi berbanding calon PAS Mohd Rizwadi Ismail yang meraih 5,741 undi. Majoriti besar dimenangi BN mewakili Kerajaan Perpaduan iaitu 3,372 undi sekali gus membolehkan parti itu merampas kembali Dun Nenggiri yang sebelum ini dimenangi Bersatu dalam Pilihan Raya Negeri yang lalu. Sementara itu, Bernama melaporkan Setiausaha Agung Umno Datuk Dr Asyraf Wajdi Dusuki sebagai berkata, BN berjaya merampas kembali kerusi Dun Nenggiri.""BN dahulu kalah dengan majoriti 810 undi kali ini BN menang dengan majoriti besar 3,372 undi,"" katanya menerusi perkongsian video yang disiarkan secara langsung di Facebook beliau malam ini. PRK DUN Nenggiri menyaksikan pertembungan satu lawan satu antara Mohd Azmawi dan Mohd Rizwadi yang mewakili Perikatan Nasional selepas Speaker Dun Kelantan, Datuk Mohd Amar Nik Abdullah mengumumkan pengosongannya pada 19 Jun lalu. Ia selepas bekas penyandangnya Mohd Azizi Abu Naim digugurkan keahlian oleh Bersatu pada 13 Jun."
Terkini: Keputusan PRK Dun Nenggiri,https://www.hmetro.com.my/utama/2024/08/1123896/terkini-keputusan-prk-dun-nenggiri,Nor Fazlina Abdul Rahim,164,"Gua Musang: Calon Barisan Nasional (BN), Mohd Azmawi Fikri Abdul Ghani berjaya merampas kerusi Dewan Undangan Negeri  (DUN) Nenggiri dengan menewaskan calon PAS Mohd Rizwadi Ismail yang mewakili Perikatan Nasional (PN), mengikut keputusan tidak rasmi setakat ini. TIDAK RASMI:  BN menang di kerusi DUN Nenggiri dengan memperoleh 9,112 undi berbanding PAS 5,741 undi. BN menang dengan majoriti 3,372 undi.7.40 malam : [Tidak rasmi] Mohd Azmawi Fikri Abdul Ghani (BN) -  7,931 undi.Mohd Rizwadi Ismail (PAS) - 5,067 undi.Setakat ini, 14 daripada 20 PDM dimenangi BN, manakala dua PDM dimenangi PAS.7.30 malam : [Tidak rasmi] Mohd Azmawi Fikri Abdul Ghani (BN) - 7,115 undi.Mohd Rizwadi Ismail (PAS) - 4,431 undi.BN mendahului dengan majoriti 2,962 undi.7.25 malam : [Tidak rasmi] Mohd Azmawi Fikri Abdul Ghani (BN) - 6,911 undi.Mohd Rizwadi Ismail (PAS) - 4,109 undi.Sebanyak 12 PDM dimenangi BN setakat ini, manakala dua PDM dimenangi PAS. Hanya enam PDM lagi belum selesai pengiraan undi. 7.18 malam :  [Tidak Rasmi] Mohd Azmawi Fikri Abdul Ghani (BN) - 6,305 undi.Mohd Rizwadi Ismail (PAS) - 3,635 undi.<7.15 malam : PDM Kesedar Limau Kasturi menjadi pusat daerah mengundi pertama dimenangi PAS. Sementara 11 PDM dimenangi BN termasuk Tohoi, Sungai Wias, Kuala Sungai, Serian, Pos Simpor, Sungai Puian, Bertam Baru, Star dan Sungai Jenera.7 malam : [Tidak Rasmi] Mohd Azmawi Fikri Abdul Ghani (BN) - 3,447 undi.Mohd Rizwadi Ismail (PAS) - 1,490 undi.Tujuh daripada 20 PDM dimenangi BN setakat ini. 6.52 petang : [Tidak Rasmi] Mohd Azmawi Fikri Abdul Ghani (BN) mendahului dengan 2,278 undi.Mohd Rizwadi Ismail (PAS) - 597 undi.  Tujuh PDM dimenangi BN setakat ini.6.36 petang : [Tidak Rasmi] Barisan Nasional (BN) menang di enam pusat daerah mengundi (PDM) yang ditutup awal, dengan majoriti 1,592 undi. Enam PDM itu adalah Tohoi, Sungai Puian, Kuala Sungai, Sungai Jenera, Pos Simpor dan Pos Sungai Wias. 6.00 petang : 20 Pusat Pengundian ditutup Gua Musang: Proses pengundian bagi Pilihan Raya Kecil (PRK) Dewan Undangan Negeri (Dun) Nenggiri berakhir selepas kesemua 20 pusat pengundian yang dibuka sejak 8 pagi tadi, secara rasminya ditutup. Sebanyak 14 pusat pengundian ditutup pada 6 petang, manakala empat pusat pengundian ditutup jam 2 petang dan dua pusat pengundian lagi ditutup pada 3 petang. Sejurus selepas pusat pengundian ditutup, semua peti undi daripada 46 saluran akan dibawa ke Pusat Penjumlahan Rasmi Undi di Dewan Kompleks Perdana, di sini. Sebelum itu, 20 pusat mengundi dibuka serentak untuk memberi ruang kepada 20,259 pengundi berdaftar melaksanakan tanggungjawab memilih wakil rakyat baharu kawasan itu.  Suruhanjaya Pilihan Raya (SPR) merekodkan peratusan keluar mengundi bagi PRK DUN Nenggiri adalah 71.87 peratus sehingga 4 petang tadi, sekali gus melebihi sasaran ditetapkan. PRK DUN Nenggiri menyaksikan pertembungan satu lawan satu antara calon BN Mohd Azmawi Fikri Abdul Ghani mewakili Kerajaan Perpaduan dan calon PAS, Mohd Rizwadi Ismail mewakili Perikatan Nasional (PN)."
