title,url,author_name,word_count,body
Rezeki kecil tapi bermakna,https://www.hmetro.com.my/utama/2024/09/1129514/rezeki-kecil-tapi-bermakna,Najiy Jefri,467,"Meskipun hanya memegang watak sampingan dalam siri popular, Projek: High Council sebagai Hakeem, namun Fadhli Masoot berjaya menambat hati penonton dengan keunikan dan kebolehannya menghidupkan watak yang diberikan. Kecemerlangannya itu membuka pintu rezeki yang luas buat Fadhli dalam industri hiburan tanah air.Populariti yang dikecapinya daripada drama itu turut membuktikan Fadhli bukan sekadar pelakon biasa sekali gus disebut-sebut sebagai salah satu bintang muda yang bakal terus bersinar.Walaupun sudah mendirikan bahtera rumah tangga dengan wanita pilihannya, Suraya pada 2 Mac lalu, namun Fadhli bersyukur kehadirannya terus diterima baik.""Waktu sebelum nak berkahwin saya akui takut dengan masa depan saya dalam bidang ini. Tapi Alhamdulillah selepas berkahwin karier seni berjalan dengan lebih baik.""Masih ada syarikat produksi yang sudi menawarkan saya berlakon. Walaupun bukanlah watak utama, tapi rezeki kecil yang saya dapat ini sangat bermakna. ""Misalnya pembabitan saya dalam drama siri One Cent Thief sebelum ini. Kalau ikutkan babak saya dalam drama itu sangat sikit, tapi bila saya keluar mereka memanggil saya dengan panggilan Shemad.""Saya sangat bersyukur penerimaan orang terhadap saya masih baik dan positif,"" katanya.Menurut Fadhli, dia mengaku perkahwinan yang dibina juga membuatkan orang luar lebih mengenalinya.""Tanpa saya sedar perkahwinan ini juga membuatkan saya naik ke satu tahap lain yang mana orang lebih mengenali saya.""Saya tak harapkan lebih pun dalam bidang ini, cukup sekadar orang sudah mengenali serta menyedari kewujudan saya dalam industri ini,"" katanya.Menyedari dirinya bukanlah sosok pilihan sebagai hero, Fadhli berkata, dia sentiasa mengingatkan diri untuk bersyukur dengan apa yang dimiliki.""Jika mahu pergi ke tahap kawan-kawan di Project: High Council itu mungkin sukar kerana saya mempunyai kekurangan dari segi fizikal. ""Namun saya sasarkan untuk menjadi pelakon serba-boleh yang mampu membawa semua jenis watak. Saya sedia mencabar diri dengan apa saja watak,"" katanya. Menyentuh mengenai kehidupan rumah tangganya, Fadhli memberitahu, dia kini berada pada fasa bahagia apabila dia dan isteri mengambil keputusan untuk tinggal berdua.""Kami ambil keputusan untuk tinggal berdua. Jadi kami baru pindah rumah dan rasa lebih seronok.""Tambah pula depan rumah ada laman, jadi sambil menunggu isteri selesai memasak saya pula berkebun dan tanam bunga mawar. Saya memang suka berkebun dari dulu,"" katanya.Ditanya adakah isterinya sudah berbadan dua, Fadhli berkata, mereka masih belum dikurniakan rezeki lagi.Dalam pada itu, Fadhli yang ditemui selepas majlis tayangan teater Andak Bertandak di Kuala Lumpur Performing Arts Centre (KLPAC) meluahkan rasa teruja dapat terbabit dalam pementasan itu.Meskipun peranan diberikan kecil namun Fadhli berjaya melepaskan gian selepas hampir dua tahun tidak beraksi di pentas teater.""Saya memang bermula dengan teater, tetapi sejak aktif dengan drama TV,  tawaran kian berkurangan. Kali terakhir saya terbabit teater adalah pada 2020.""Saya harap dapat peluang untuk berlakon teater sekurang-kurangnya satu naskhah setahun kerana memang itu minat saya, sementara berlakon drama dan filem pula adalah untuk cari rezeki,"" katanya."
Sentiasa fikir positif pacu kejayaan Eddy sumbang pingat pertama Paralimpik Paris,https://www.hmetro.com.my/utama/2024/09/1129490/sentiasa-fikir-positif-pacu-kejayaan-eddy-sumbang-pingat-pertama-paralimpik,Bernamar,304,"Paris: Atlet olahraga para negara Eddy Bernard tidak melihat kekurangan fizikal menghalang dirinya daripada berjaya dalam hidup apatah lagi mengharumkan nama negara dengan menjelmakan kilauan pingat sulung Malaysia pada Sukan Paralimpik Paris 2024.Eddy menghadiahkan pingat gangsa 100 meter (m) lelaki T44 (kecacatan fizikal) buat negara dengan catatan 11.58 saat (s) pada hari keempat Sukan Paralimpik 2024 di Stade de France.Walaupun dilahirkan dengan keadaan tangan dengan sebahagian jari bersambung dan kaki kecil di bahagian kanan, atlet dari Beluran, Sabah, itu sentiasa berfikiran positif malah sering meletakkan dirinya mampu membuat apa yang manusia dilahirkan dalam keadaan cukup sifatnya lakukan.""Bila lihat orang lebih sempurna fizikalnya boleh buat, saya pun boleh. Saya selalu cuba positifkan diri saya.""Kadang-kadang pernah rasa rendah diri namun saya cuba alih fikir benda lain dan lawan diri untuk positif...jangan fikir negatif,"" katanya ketika ditemui pada zon campuran di sini, hari ini. Bukan sahaja memenangi gangsa, malah catatan masa 11.58s dilakukannya turut memecahkan rekod Asia terdahulu milik wakil Sri Lanka, Indika Gamage iaitu 11.75s pada Kejohanan Olahraga Para Dunia 2024 di Kobe, Jepun, Mei lalu.Dalam pada itu, pingat emas disambar wakil Afrika Selatan, Mpumelelo Mhlongo dengan catatan 11.12s manakala pingat perak menjadi  milik atlet Cuba, Yamel Luis Vives Suares dengan masa 11.20s.Atlet berusia 23 tahun itu juga sememangnya dapat merasakan mampu menyumbang pingat pertama negara pada hari keempat temasya sukan berprestij dunia itu.Dia berkata, kata-kata azimat jurulatihnya, Hamberi Mahat sebelum pertandingan juga banyak membakar semangatnya  melakar kejayaan tertinggi dalam karier sejak mula mewakili negara pada 2017.""Coach kata bantai, bantai dan langgar sahaja, jangan banyak fikir, fikir diri sendiri sahaja,"" kata anak bongsu daripada enam beradik itu.Pemenang perak Kejohanan Olahraga Para Dunia 2024 itu juga pada masa sama mahu mendedikasikan pingat gangsa dimenanginya kepada keluarga, Hamberi dan rakan-rakan atas dorongan diberikan mereka kepadanya selama ini.Sukan Paralimpik Paris 2024 yang bermula 28 Ogos berakhir 8 Ogos ini."
'Isteri dan emak sudah nyawa-nyawa ikan ketika cuba diselamatkan',https://www.hmetro.com.my/utama/2024/09/1129405/isteri-dan-emak-sudah-nyawa-nyawa-ikan-ketika-cuba-diselamatkan,Zuliaty Zulkiffli,349,"Sungai Petani: ""Sejurus kemalangan berlaku, saya dapati anak bongsu, isteri dan emak 'hilang' dan saya cuba mencari mereka dalam kereta tetapi tiada.""Ketika itu hanya anak sulung, Luth Mikhael, 3, berada di bahagian belakang kereta. Tidak lama kemudian, ada penduduk kampung datang membawa anak, Lufiya Mikhayla, 2, sambil memberitahu isteri dan emak tercampak keluar dari kereta,"" kata Mohd Fadzil Othman, 27.,Menurutnya, dia kemudian bergegas mendapatkan isterinya, Siti Norhasliza Kamarudin, 26, yang tercampak beberapa meter dari kereta yang ketika itu dalam keadaan nyawa-nyawa ikan.Katanya, dia juga sempat mengajar isterinya mengucap dua kalimah syahadah sebelum arwah menghembuskan nafas terakhirnya.""Saya kemudian mendapatkan emak, Omi Kalsom Man, 69, yang ketika itu dalam keadaan sama, sangat nazak sebelum meninggal dunia di tempat kejadian,"" katanya ketika ditemui di rumahnya di Kampung Haji Ngah, Bedong, di sini, hari ini.Menurutnya, kemalangan itu berlaku selepas mereka sekeluarga dalam perjalanan pulang dari berkelah di Sungai Sedim sempena cuti umum Hari Kebangsaan, semalam.Katanya, dia tidak merancang untuk bercuti di kawasan perkelahan itu dan isterinya turut mengajak dia pergi ke situ untuk membawa anak-anak serta ibunya.""Kakak saya dan rakannya membawa keluarga ke sana dan sempat menikmati makan tengah hari bersama, isteri serta anak-anak kelihatan seronok sebelum kami pulang jam 4 petang,"" katanya. Menurutnya, sebaik tiba di lokasi kejadian seekor binatang dipercayai kera melintas secara tiba-tiba menyebabkan dia cuba mengelak.Katanya, dia memusingkan stereng kereta menyebabkan Toyota Vios dipandunya terbabas ke laluan bertentangan sebelum masuk ke dalam semak.""Tak banyak perubahan yang berlaku pada emak dan isteri sebelum ini malah kami sempat berbual dalam kereta sebelum kemalangan berlaku dan sekelip mata saya kehilangan mereka.""Saya hanya sakit di bahagian bahu kanan manakala Luth Mikhael tidak cedera dan Lufiya Mikhayla pula masih dirawat di Hospital Sultanah Bahiyah (HSB) di Alor Setar akibat parah di kepala,"" katanya.Media sebelum ini melaporkan, dua beranak maut selepas kenderaan yang dinaiki mereka terbabit dalam dalam kemalangan dipercayai cuba mengelak kera melintas di Simpang Tiga Kuala Bakong, Jalan Malau- Kuala Ketil, semalam.Dalam kejadian jam 6.12 petang itu, mangsa Siti Norhasliza Kamarudin dan ibu mentuanya, Omi Kalsom Man, 69, disahkan meninggal dunia di tempat kejadian."
"'Bukan cari hantu, bongkar lokasi keras'",https://www.hmetro.com.my/utama/2024/09/1129289/bukan-cari-hantu-bongkar-lokasi-keras,,537,"Kulim: ""Lagi banyak kisah menakutkan berlaku di tempat itu, lagi teruja saya untuk sampai dan menjelajah segenap sudut kawasan berkenaan. ""Rasa ingin tahu yang meluap-luap mengatasi rasa takut. Setakat ini belum ada kejadian mudarat menimpa saya sejak terbabit dalam eksplorasi malam secara bersendirian di lokasi 'keras' di Malaysia,"" ujar pempengaruh paranormal, Hanizamal Abu Hanifah atau lebih dikenali sebagai Solo Ambush. Keberanian Hanizamal memberi inspirasi kepada ramai pengikutnya selepas dia kerap ' menerjah' kawasan dikatakan paling menyeramkan di Malaysia atau luar negara secara sendirian. Menurut pencipta kandungan itu, bukan hanya lokasi dalam negara, beberapa lokasi luar negara seperti Istana Dracula di Romania dan 'Hutan Bunuh Diri' di Jepun pernah dilawati dan menjadi kandungan Tiktok. ""Saya sudah biasa bergerak sendiri berikutan mempunyai pengalaman ketika menjadi pendaki gunung. ""Ketika bermalam di puncak gunung seorang diri, saya terpaksa berdepan dengan pelbagai 'gangguan'. Saya berkongsi aktiviti di gunung dengan membuat 'live' menerusi Facebook dan ketika itu sudah ramai meminta saya menyelidik lokasi 'keras' seperti Villa Nabila dan Pulau Besar. ""Peranan saya tidak semestinya mencari hantu, sebaliknya lebih kepada kegiatan membongkar sama ada di lokasi 'keras' itu wujud entiti atau benar-benar menyeramkan. Saya masih aktif berkongsi di platform FB dan Tiktok,"" katanya. Hanizamal memaklumkan, kandungan dikongsi bukan hanya berkisar isu paranormal malah dia turut menggemari rahsia alam ghaib dan ilmu warisan Melayu yang tidak ramai ketahui. ""Kandungan saya bukan hanya menjejak entiti atau lokasi seram di Malaysia atau di luar negara. Saya juga meminati sejarah dan ilmu warisan Melayu selain kisah kehebatan orang lama. ""Saya turut mengkaji dan memperincikan berkaitan ilmu kebal, mandi minyak dan banyak lagi. Pada saya kisah ini tidak banyak diceritakan dan sewajarnya perlu direkod untuk diceritakan pada generasi akan datang,"" katanya.  Hanizamal berkata, dia mengambil langkah berhati-hati terutama dalam persiapan menjelajah bersendirian di lokasi berisiko. ""Sebagai penjelajah solo di kawasan yang ditakuti orang ramai, saya kena ambil langkah berjaga-jaga. ""Selain peralatan dan gajet mencukupi, saya juga akan teliti risiko dan lakukan penilaian di kawasan lapangan. ""Walaupun berada solo di lokasi namun ada masanya saya dipantau seorang pembantu yang berada agak jauh dari kawasan dilawati. ""Sebenarnya interaksi secara langsung dengan penonton juga antara kaedah selamat bagi memastikan pergerakan saya dilihat ramai,"" katanya. Menurutnya, tiada amalan rahsia sebaliknya meletakkan pergantungan penuh kepada Allah SWT. ""Asas penting adalah perlu ada ilmu ikhtiar hidup berikutan kebanyakan lokasi dituju adalah kawasan terbiar dan sudah menjadi belukar.""Dalaman jiwa kena kuat contohnya bekalan amalan seperti bacaan potongan ayat al-Quran. Perlu lakukan kaji selidik berdasarkan perkongsian atau maklumat dikongsi orang juga adalah adab apabila memasuki kawasan orang,"" katanya. Kata Hanizamal, biasanya entiti akan memberikan isyarat tertentu menunjukkan kewujudannya di kawasan tertentu. Meskipun berdepan pelbagai gangguan sepanjang menghasilkan kandungan, dia tidak serik. ""Saya dalam perancangan ingin membongkar rahsia Segi Tiga Bermuda dan akan berada di sana selama tiga hari secara solo.""Saya anggarkan kos untuk merealisasikan misi ini memerlukan RM300,000. Kos meliputi sewa kapal atau bot, penerbangan dan permit skuba dan sebagainya. ""Walaupun ia kerja gila, pada saya itu antara impian ingin dicapai dan tidak semua orang ada keberanian sebegitu. ""Setidak-tidaknya apabila saya dapat rakam video  kawasan itu, orang Malaysia juga berpeluang mengetahui kisah di sebalik rahsia Tiga Segi Bermuda itu,"" katanya.Penglipur lara cerita seram!Rungkai mistik tersebarTipu penonton demi keuntungan tindakan tidak beretika"
Penglipur lara cerita seram!,https://www.hmetro.com.my/utama/2024/09/1129284/penglipur-lara-cerita-seram,Suliati Asri dan Nurul Husna Mahmud,547,"Kuala Lumpur: ""Berbanding kandungan 'memburu' hantu, saya lebih suka dikenali sebagai penjejak ekplorasi malam. Pengisian saya lebih berorientasikan saintifik dalam pembuktian fenomena aneh yang berlaku termasuklah aktiviti paranormal,"" ujar pempengaruh media sosial yang hanya mahu dikenali sebagai Tiger Labu. Katanya, dia yang bermula dengan platform Bigo berjaya menarik perhatian netizen sejak 2 tahun lalu selain menghasilkan kandungan ekplorasi malam sejak 2019.  ""Bukan hanya peminat bola sepak ekstrem, kumpulan peminat pempengaruh juga tidak kurang fanatik. Saya pernah dikritik dan dikecam oleh segelintir peminat pempengaruh yang fanatik apabila menerima anugerah Creator of The Year 2023. ""Jika saya masuk untuk meninjau dan berkongsi sesuatu kawasan, saya tidak fokus hanya terhadap elemen hantu atau entiti yang ada. ""Biasanya ia lebih kepada penceritaan dan sejarah lokasi itu supaya pengikut atau penonton saya dapat maklumat yang manfaat,"" katanya. Tambah Tiger Labu, lokasi dipilih berdasarkan kisah seram unik selain saranan pengikutnya. ""Saya lebih suka tempat yang jarang diekplorasi tetapi cukup digeruni penduduk setempat. ""Contohnya di Indonesia, satu hospital lama dikatakan sangat 'angker' (berhantu) oleh penduduk tempatan, saya cuba selidik kesahihannya. ""Tidak dinafikan apabila setibanya di dalam salah satu bilik seperti bilik bedah, tiba-tiba ghost box iaitu peranti memberi reaksi positif atau menandakan ada gelombang 'misteri' memberi tindak balas. ""Sebenarnya rasa seram sejuk itu benar-benar dirasai dalam bilik bedah itu. Suhunya jauh lebih sejuk berbanding bilik lain di aras yang sama. ""Saya cuba berkomunikasi termasuklah bertanya arah dan siapa nama (penghuni ghaib di bilik itu). Itu antara kaedah penjejak eksplorasi malam atau paranormal untuk mengesan entiti yang ada. ""Rezeki saya ketika itu, dia (entiti) memandu arah saya agar memandang di cermin dalam bilik itu, ketika itu saya nampak seperti ada kelibat pocong,"" katanya yang menetap di Shah Alam, Selangor.  Kata Tiger Labu, pengalaman itu tidak membuatkannya serik sebaliknya teruja untuk terus menjejak lokasi 'angker'.  ""Saya tidak bermaksud untuk riak tetapi saya anggap itu antara makhluk alam ghaib. Sebagai Khalifah Allah tahu kewujudannya. ""Saya cuba mahu pelajari dan mengenali selain mendidik masyarakat agar tidak takut menghadapi entiti seperti itu. ""Kalau tahap keseraman gangguan entiti di negara jiran atau luar negara saya pernah pergi, rasanya kisah atau lokasi di Malaysia lebih seram. ""Aura seram lebih terasa di lokasi seperti Penjara Pudu, Pulau Jerejak atau Penjara Taiping. Ini kerana dalam fikiran kita sudah ada gambaran atau rupa hantu menakutkan seperti mana popular dalam masyarakat kita,"" katanya. Kata Tiger Labu, lagi banyak reaksi atau 'gangguan' diterima, lagi baik untuk kandungan dan penontonnya.  ""Sebagai pencipta kandungan eksplorasi malam, saya lebih suka berkongsi kisah benar-benar berlaku tanpa 'prop'. ""Tetapi kadang-kala ia mengundang rasa kurang puas hati dalam kalangan penonton kerana tidak semua 'hantu' muncul dalam 'live'.  ""Saya pernah kena marah gara-gara tiada aktiviti entiti dirakam dan pada saya selaku pencipta kandungan lebih suka hasilkan karya yang jujur untuk penonton. ""Penonton sekarang sudah bijak dan mereka tidak suka sesuatu yang 'diada-adakan' atau lakonan untuk memberi kesan seram. ""Pada saya ia suatu yang bagus buat penonton di Malaysia. Ia menjadi pendorong untuk saya meneruskan kerja menghasilkan kandungan bermutu dan memiliki kredibiliti. ""Saya sangat berterima kasih dan menghargai pemberian (Gift) dari pengikut dan 'live' yang merealisasikan setiap aktiviti eksplorasi malam,"" katanya. Menurutnya, dia hanya sempat berehat tiga hari dalam tempoh 1 tahun 10 bulan bagi menghasilkan kandungan setiap minggu.'Bukan cari hantu, bongkar lokasi keras'Rungkai mistik tersebarTipu penonton demi keuntungan tindakan tidak beretika"
"Tang Jie-Ee Wei cipta sejarah peribadi, juara Terbuka Korea",https://www.hmetro.com.my/utama/2024/09/1129265/tang-jie-ee-wei-cipta-sejarah-peribadi-juara-terbuka-korea,Amirul Fazli Zukafli,281,"Kuala Lumpur: Beregu campuran negara, Chen Tang Jie-Toh Ee Wei mencipta rekod peribadi terbaik buat mereka apabila pertama kali muncul juara di kejohanan berstatus Super 500 selepas menewaskan wakil China, Gou Xin Wa-Li Qian di Terbuka Korea, sebentar tadi. Ringkasan BeritaChen Tang Jie-Toh Ee Wei menewaskan wakil China, Gou Xin Wa-Li Qian di final Terbuka Korea.Kemenangan 17-21, 21-13, 21-13 mengambil masa 59 minit.Pencapaian terbaik mereka dalam kejohanan berstatus Super 500.Pada aksi final berlangsung di Stadium Tertutup Mokpo hari ini, ia bukan perlawanan mudah buat mereka apabila perlu melakukan kebangkitan di dua set terakhir sebelum mengesahkan kemenangan dalam pertarungan tiga set, 17-21, 21-13, 21-13 dalam masa 59 minit. Di set pertama, beregu campuran negara bermula agak goyah apabila banyak melakukan kesilapan kecil hingga membolehkan lawan mereka menjarakkan kedudukan mata lebih jauh. Meskipun cuba melakukan kebangkitan di penghujung permainan tetapi ia agak lewat untuk menghalang wakil China itu menang set berkenaan. Menyedari misi wajib menang di set kedua, Tang Jie-Ee Wei memperkemaskan gaya permainan serta bermula dengan sangat baik di awal permainan dan berjaya mendapatkan lapan mata berturut-turut selain tidak banyak kesilapan mudah dilakukan untuk menang set ini dan bawa ke set penentuan. Momentum kemenangan itu diteruskan oleh beregu negara apabila berjaya mengawal permainan dengan baik meskipun Xin Wa-Li Qian juga memberi tentangan sengit dalam set ketiga itu. Namun begitu, pengalaman yang ada pada beregu kesembilan dunia itu ternyata membantu mereka untuk mengawal tekanan dalam gelanggang sekali gus memastikan kemenangan memihak kepada mereka. Sebagai rekod, pencapaian terbaik Tang Jie-Ee Wei di kejohanan berstatus lebih tinggi dari Super 300 iaitu mara ke separuh akhir Terbuka Singapura 2023 (Super750), separuh akhir Terbuka China 2023 (Super 1,000), separuh akhir Terbuka Arctic 2023 (Super 500), dan separuh akhir Masters Malaysia 2024 (Super 500)."
Membesar dengan lagu Raja Gambus,https://www.hmetro.com.my/utama/2024/09/1129226/membesar-dengan-lagu-raja-gambus,Nurul Husna Mahmud,470,"Kuala Lumpur: ""Saya dibesarkan dalam persekitaran tidak mengenal erti prejudis. Bapa saya, mendiang Prof Emeritus Tan Sri Dr Khoo Kay Kim berketurunan Cina Peranakan dan ibu pula Puan Sri Rathi Khoo berbangsa India dari jalur Sri Lanka. ""Mereka menggaji pengasuh wanita Melayu dari Negeri Sembilan untuk mengasuh saya dan dua adik-beradik yang lain,"" ujar Pengasas Pusat Budaya (Pusaka), Eddin Koo mengenai pengalaman sebenar beliau sebagai anak Malaysia. Beliau yang juga penulis dan wartawan berkata, menyemai nilai tidak prejudis terhadap bangsa lain perlu bermula dengan didikan dari rumah. ""Mereka yang mengenali mendiang bapa, semestinya sudah arif dengan perjuangan beliau. ""Sisi lain beliau sebagai figura seorang bapa ialah seorang yang gemar berjenaka. Jenaka beliau selalunya memetik dialog seloka daripada naskhah Tan Sri P Ramlee. ""Saya pula membesar dengan mendengar lagu klasik dan tradisional Melayu daripada artis seperti Raja Gambus Malaysia Fadzil Ahmad dan penyanyi, SM Salim seawal usia tiga tahun. ""Jadi tentu sahaja itu membuatkan jiwa saya 'dekat' kepada orang Melayu dan kalau lihat keluarga saya sudah merangkumi apa  dikatakan semangat satu Malaysia,"" katanya. Bagi rakyat Malaysia yang hanya mengenali SM Salim sebagai penyanyi, satu fakta lain menarik mengenai Allahyarham adalah beliau seorang pemain badminton hebat. Tambahnya apabila menjadi aktivis budaya dan mengangkat seni warisan di mata dunia sehingga menerima pengiktirafan Pertubuhan Pendidikan, Sains dan Kebudayaan Pertubuhan Bangsa-Bangsa Bersatu (Unesco), dia melihat sendiri cara 'dunia' memandang Malaysia sangat baik.' ""Masyarakat dunia mengenali kita sebagai negara memiliki kepelbagaian dan sebenarnya dalam Malaysia itu sendiri merangkumi satu dunia. ""Persepsi luar terhadap orang Malaysia apabila saya memperkenalkan diri dari Malaysia, mereka visualkan kita sebagai orang mesra, rajin, tekun dan bijak. ""Permulaannya satu negara terpencil tetapi dunia mudah 'tersentuh' dengan rakyat kita kerana karakter orang Malaysia cukup dikenali pandai ambil hati,"" katanya.  Tambah Eddin Koo, karakter itu jugalah yang menjadikan masyarakat Malaysia itu mudah mesra dan mengenepikan perbezaan. Dia mengakui pengembangan budaya itu dapat dilakukan, walaupun yang melakukan atau ingin mewarisi budaya itu adalah berlainan bangsa. ""Pengalaman saya sendiri terbabit dalam penyelidikan terhadap seni warisan Pantai Timur seperti Wayang Kulit dan Mak Yong, saya perasan orang Melayu ini sikap terbukanya tiada tolak bandingan. ""Mereka ini mudah menerima saya sebagai ahli keluarga meskipun tiada pertalian darah dan mereka ini adalah orang dengan yang memiliki bangga terhadap warisan budaya dan keyakinan diri tinggi. ""Contohnya Tok Dalang tersohor di Kelantan, Abdullah Ibrahim atau lebih mesra dengan panggilan 'Dollah Baju Merah' menjadi bapa angkat ketika saya mempelajari mengenai wayang kulit. ""Mereka inilah banyak mengajar dan mengingatkan saya mengenai jati diri sebagai anak Malaysia,"" katanya. Saranan beliau kepada generasi anak muda sekarang supaya hidup dengan cara meneroka lebih banyak ilmu dan budaya tempatan. ""Anak muda jangan menjadi orang biasa, banyakkan mencari pengalaman dan pengalaman perlulah diperoleh di luar telefon. ""Jangan ikut kebiasaan dan menjadi orang muda perlu mengkaji dan mencari 'angin sendiri',"" katanya."
Israel buru Yahya Sinwar,https://www.hmetro.com.my/utama/2024/09/1129217/israel-buru-yahya-sinwar,Agensi,358,"Washington: Januari lalu, pegawai Israel dan Amerika Syarikat (AS) merasakan mereka mungkin mendapat petunjuk penting dalam usaha untuk menangkap pemimpin utama Hamas yang paling dicari iaitu Yahya Sinwar.Pada 31 Januari lalu, komando Israel melancarkan serbuan ke atas kompleks terowong canggih di selatan Gaza, berdasarkan maklumat yang menunjukkan lokasi Sinwar.Menurut New York Times (NYT), serbuan itu dikatakan hanya menemukan dokumen dan wang tunai shekel Israel, tetapi Yahya sudah meninggalkan tempat berkenaan beberapa hari sebelumnya.Sejak serangan di selatan Israel pada 7 Oktober 2023, yang dirancang Yahya, lelaki itu hampir tidak kelihatan. Beliau jarang muncul di khalayak ramai, tidak mengeluarkan kenyataan untuk pengikutnya dan sukar dikesan.Yahya adalah figura penting dalam Hamas dan kejayaannya mengelak daripada ditangkap Israel, 'menafikan' peluang musuh untuk mengisytiharkan kemenangan. Ia walaupun sebahagian besar Gaza sudah musnah.Pegawai AS dan Israel melaporkan bahawa Yahya sudah lama tidak menggunakan komunikasi elektronik dan kini bergantung kepada rangkaian pengantara manusia untuk berhubung dengan Hamas. Taktik ini menyerupai strategi digunakan oleh Osama bin Laden.Berbeza dengan Osama yang semakin tidak aktif menjelang akhir hayatnya, Yahya masih aktif menguruskan operasi ketenteraan Hamas. Ini menjadikan usaha untuk menangkapnya lebih rumit. Lapor NYT lagi, diplomat terbabit dalam rundingan gencatan senjata di Doha, Qatar, menyatakan bahawa wakil Hamas memerlukan input Yahya untuk membuat keputusan penting sekali gus membayangkan peranan pentingnya dalam organisasi berkenaan.Israel dan AS juga menggunakan sumber yang banyak dalam usaha mencari Yahya. Unit khas ditubuhkan di dalam Shin Bet iaitu perkhidmatan perisikan domestik Israel, manakala agensi perisikan AS turut terbabit dalam menjejaki Yahya. AS juga menyediakan radar tembus tanah untuk membantu pencarian itu.Menangkap atau membunuh Yahya berpotensi memberikan kesan besar terhadap konflik Israel-Hamas. Pegawai AS percaya ia boleh memberikan kemenangan ketenteraan penting kepada Perdana Menteri Israel, Benjamin Netanyahu, dan mungkin mempengaruhi kesediaan beliau untuk menghentikan operasi ketenteraan di Gaza.Namun, menurut NYT, kematian Yahya juga mungkin mempengaruhi rundingan untuk pembebasan tebusan. Penggantinya mungkin kurang cenderung untuk berunding dengan Israel.Untuk rekod, Yahya, 61, diumumkan sebagai ketua politik utama Hamas, Ogos lalu, selepas kematian Ismail Haniyeh di Tehran. Walaupun jawatan rasmi sebelum ini dipegang oleh pegawai Hamas di Doha, Yahya sudah lama dianggap sebagai pemimpin de facto kumpulan itu."
