title,url,author_name,word_count,body
Buktikan persepsi salah,https://www.hmetro.com.my/utama/2024/08/1127749/buktikan-persepsi-salah,Hafiz Ithnin,834,"Kuala Lumpur: Nisbah tenaga kerja tempatan dan asing sebanyak 1:4 dalam sektor pembinaan menunjukkan kebergantungan Malaysia kepada buruh asing masih terlalu tinggi. Namun, ramai rakyat tempatan tidak menyedari pembabitan dalam sektor pembinaan mampu menjana pendapatan melebihi upah sektor kolar biru. Lebih mendukacitakan, persepsi melanjutkan pengajian dalam bidang Pendidikan dan Latihan Teknikal dan Vokasional (TVET) juga sering dikaitkan dengan elemen bahaya, kotor dan sukar (3D) selain berpendapatan rendah. Persepsi ini perlu diubah berikutan TVET sektor yang terbukti melahirkan ramai usahawan berjaya bergelar jutawan. Mohamad Hanip Mansor, 49  ""Sebaik tamat Sijil Pelajaran Malaysia (SPM), saya terus melanjutkan pendidikan TVET di bawah Giat Mara pada 1992. ""Persepsi masyarakat seperti biasa, budak-budak tidak cerdik sahaja pergi ke jurusan pembinaan ini,"" katanya. Menurutnya, sebaik menamatkan pengajian dalam bidang TVET, dia bekerja 10 tahun sebagai juruteknik penyejukan udara di sebuah kilang di Pulau Pinang. Katanya, dalam tempoh itu, dia meneroka kemahiran di dalam bidang berkenaan dan membuka perniagaan sendiri sebagai juruteknik penghawa dingin. ""Menjadi usahawan bukan perkara mudah dan saya turut mempelajari pelbagai bidang ilmu lain untuk mengukuhkan perniagaan. ""Meskipun saya ada kemahiran dalam bidang penyejukan udara, tetapi ia saling bersangkut paut dengan bidang pembinaan lain. ""Saya akui pernah jatuh dalam perniagaan suatu masa dahulu dan bangun semula pada 2010 untuk ceburi bidang pembinaan yang begitu luas,"" katanya. Pada 2013, Hanip bergelar kontraktor kelas G1 dan kini dia mampu mengurus projek mencecah RM2 juta setahun dan mempunyai 14 kakitangan. Katanya, kerajaan sudah menyediakan pelbagai platform terbaik bagi membantu rakyat tempatan mencipta kerjaya  dalam sektor pembinaan. ""Jika diamati, kita ada sektor TVET yang membuka langkah pertama orang muda tempatan menimba ilmu. ""Selepas tamat pengajian mereka boleh gilap kemahiran dalam industri dan dalam masa sama cuba mencari peluang membina kerjaya sendiri,"" katanya. Katanya, masyarakat perlu sedar melanjutkan pendidikan dalam TVET langkah awal melahirkan usahawan pembinaan yang berjaya.   Siti Sofya Sabtu, 34  Anak kelima daripada enam beradik ini pelajar pintar, tetapi memilih melanjutkan pendidikan dalam bidang TVET selepas mendapat keputusan Sijil Pelajaran Malaysia (SPM). Bagi Sofya, tiada apa perlu dimalukan meskipun pada awalnya ada tanggapan dia buat kesilapan dalam membina kerjaya. Sofya berkata, dia melanjutkan pengajian di peringkat Sijil Kejuruteraan Mekanikal di Politeknik Pauh, Perlis pada 2008. Dia kemudian mengambil Sijil Kimpalan Fabrikasi Logam dan Sijil Kemahiran Malaysia tahap 1. ""Pada 2011 pula, saya lanjutkan pengajian di peringkat Diploma Kejuruteraan Mekanikal. Pada 2018, baharu saya lanjutkan pengajian di peringkat Ijazah Sarjana Muda Antroplogi dan Sosiologi di Universiti Sains Malaysia (USM). ""Sebenarnya ketika di peringkat sijil, saya sudah buka perniagaan sendiri pada 2010 iaitu dengan menawarkan perkhidmatan kimpalan besi kecil-kecilan dan hanya menumpang bengkel orang lain untuk beroperasi,"" katanya. Menurutnya, ketika itu agak sukar mendapatkan pelanggan kerana persepsi kejanggalan wanita melakukan tugas itu. Namun, dia tetap cekal untuk membuktikan kepada pelanggan dia sebagai wanita boleh memberikan kualiti kerja yang terbaik. ""Pada awalnya pelanggan melihat saya sebagai 'semut kecil' yang hanya boleh melakukan kerja kimpalan 'serpihan' sahaja dalam fabrikasi logam. Namun, dari semasa ke semasa saya tunjukkan keupayaan kualiti kerja setanding dengan mereka berpengalaman. ""Syukur selepas tiga tahun, saya kukuh dan mampu mempunyai pekerja sendiri. Kini saya ada perniagaan kejuruteraan, sewaan jentera, industri gas, perkakasan dan fabrikasi logam,"" katanya. Ditanya mengapa tidak melanjutkan pengajian di universiti selepas SPM, katanya, bermula dari bawah lebih baik untuk menggilap kemahiran dalam industri pembinaan. ""Bagi saya kemahiran satu ikhtiar hidup. Dari awal saya sedar menerokai bidang pembinaan mampu jamin masa depan lebih baik setanding graduan lulusan di universiti. ""Segala-galanya bermula daripada pembelajaran TVET yang ramai lihat ia sebagai satu bidang tidak menjamin masa depan dan hanya untuk mereka yang tidak cemerlang dalam akademik,"" katanya.  Mohamad Ismaydi Mohamad Noor, 48  ""Bidang kemahiran adalah perkara paling penting dan menarik dalam kehidupan. Biarpun ia sering dilihat satu bidang tidak popular, tetapi ia mampu melahirkan usahawan,"" katanya. Ismaydi berkata, sebaik tamat pendidikan dalam bidang TVET di Giat Mara, Tanah Merah, Kelantan, dia bekerja sebagai juruteknik elektrik selama tiga tahun di Puchong, Selangor. Ketika itu, dia tertarik dengan industri pembinaan yang dilihat mampu menjana pendapatan jika boleh menjadi pembekal barangan kepada pemain industri. ""Dalam tempoh tiga tahun, saya menjadi pemerhati dalam urusan jual beli membabitkan barangan pembinaan. Kemudian saya tekad berhenti kerja dan pulang ke Kelantan untuk membuka perniagaan sendiri iaitu menjadi pembekal barangan pembinaan kepada pemain industri. ""Ketika itu sekitar 2003, saya akui bukan mudah menjadi usahawan dalam bidang ini kerana dari segi ilmu barangan jualan saya mahir, namun dari segi selok-belok perniagaan perlu ambil masa untuk matang,"" katanya. Katanya, antara cabaran awal dihadapi untuk mengurus kos daripada pembekal utama, mendapatkan pembekal dan modal. ""Saya tidak mengalah dengan cabaran. Banyak jatuh bangun saya dalam membina perniagaan ini... ia proses pembelajaran untuk menjadikan kita matang pada masa depan untuk kukuhkan jenama. ""Saya bersyukur dengan adanya ilmu kemahiran banyak membantu berkaitan barangan teknikal untuk dibekalkan kepada kontraktor. ""Dari semasa ke semasa saya perlu meningkatkan ilmu pengetahuan mengenai teknologi baharu supaya dapat diterangkan kepada pelanggan,"" katanya. Kini, Ismaydi mempunyai lima cawangan perniagaan di Kelantan yang membekalkan pelbagai barangan industri pembinaan dan mempunyai 65 pekerja di bawahnya. Katanya, pilihannya melanjutkan pengajian di peringkat TVET yang disokong keluarga sebenarnya yang terbaik untuk kerjayanya sebagai usahawan pada hari ini,"" katanya."
Peluang julang muzik Borneo,https://www.hmetro.com.my/utama/2024/08/1127725/peluang-julang-muzik-borneo,Georgie Joseph,789,"TRIO jelitawan dari Borneo, Marsha Milan, Velvet Aduk dan Alena Murang bakal memahat sejarah tersendiri apabila buat julung kali beraksi di Dewan Filharmonik Petronas (DFP) bersama Orkestra Filharmonik Malaysia (MPO) pada 7 September ini.Gandingan penyanyi hebat yang menjayakan Konsert Sounds of Borneo. Menyifatkan peluang itu terlalu besar makna buat mereka bertiga secara peribadi. Ini adalah hadiah terindah atas keteguhan mereka memperjuang lagu-lagu dari Sabah dan Sarawak.Marsha atau nama sebenarnya Marsha Milan Londoh, 39, pencapaian itu cukup berbeza dengan apa yang dia miliki dalam karier seninya sekarang. Memang namanya kukuh dalam arus perdana tapi karya Borneo baginya cukup istimewa di hati.Beberapa tahun lalu, dia bersama teman baiknya Velvet ambil risiko buat projek lagu rakyat Sabah. Kerja-keras mereka berhasil apabila lagu hit seperti Sumandak Sabah berjaya menakluk pendengar dari pelbagai lapisan masyarakat.Jadi, apabila dapat membawa karya-karya itu ke pentas arus perdana, sangat menyentuh Marsha secara peribadi. Dia sendiri ingin terus mendidik rakyat Semenanjung mengenai kekayaan budaya Borneo.""Ini adalah mimpi jadi kenyataan untuk bekerja dengan MPO. Kami semua sangat teruja untuk konsert itu kerana ini adalah perjuangan kami martabatkan budaya sebagai warga Borneo. Ia juga mewakili puncak karier muzik kami.""Bermula dengan projek suka-suka, apabila melihat ramai yang menyokong karya Borneo kami, kami mahu terus menyumbang. Kami mahu mendidik terutama rakyat di Semenanjung semua aspek kebudayaan kami.""Pada masa sama, kami sendiri pun mahu terus mendalami budaya sendiri. Masih terlalu banyak yang kami tidak didedahkan. Lagu-lagu rakyat kami hasilkan pun boleh dikira cuma tampilkan permukaan budaya kami saja,"" katanya.Bagi Velvet atau nama sebenarnya Velvet Lawrence Aduk, 37, hakikatnya dia tidak pernah terbayang akan dapat peluang sebesar itu. Apalagi peluang itu adalah untuk meraikan muzik-muzik dari sebelah Borneo.""Kami selalu hasilkan lagu rakyat Sabah sebagai projek sendiri saja. Jadi, berhasil membawakan ke tahap lebih tinggi dan diiktiraf di pentas begini, agak mendebarkan juga.""Tapi pada masa sama, kami sangat gembira kerana mampu angkat lagi budaya kami untuk dilihat lebih ramai orang. Terutama buat warga Semenanjung. Memang kami sentiasa nantikan peluang begini.""Pencapaian ini adalah sangat besar untuk kami semua. Walaupun dalam hati rasa sangat risau untuk beraksi, tapi jemputan itu benar-benar satu penghormatan bermakna,"" katanya.Velvet tidak menafikan terbit rasa gementar kerana pentas DFP bertaraf antarabangsa dan cukup tinggi kelasnya. Menurutnya mereka sendiri teringin melihat kejutan buat diri apabila beraksi di samping MPO kelak.""Kelainan itu akan lebih kepada susunan muziknya. Ini kerana lagu-lagu kami rata-rata kedengaran sama dengan rentak kebiasaan Sabah dan Sarawak. Bila digabung dengan orkestra sendiri, itulah sebenarnya keistimewaan terbesar nanti.""Kami membawa lagu-lagu keraian kepada kelas lebih tinggi. Kami pun ternanti untuk kejutkan diri-sendiri juga. Kami pun awal-awal dulu hasilkan lagu kami secara spontan dan mutunya pun terikat dengan bajet terhad.""Yang buat saya gementar adalah melihat bagaimana kami bergabung sama atas satu pentas dan beraksi secara langsung. Ini kerana kami pun jarang adakan persembahan bersama disebabkan berjauhan,"" katanya. Alena atau nama sebenarnya Alena Ose' Murang, 35, pula gembira apabila pentas itu menjadi saksi perit jerihnya memperjuangkan instrumen tradisi Sape. Dia sendiri memang ada misi untuk tembus arus perdana.""Orang di Semenanjung memang nak tahu pasal Sape dan Sarawak. Tapi cabarannya, bagaimana nak bawa keluar penggunaan instrumen itu daripada acara-acara atau tujuan projek berkisar pelancongan semata-mata.""Biasanya memang untuk iklan dan showcase mengenai topik itu saja. Masih boleh, tapi bagaimana nak komersialkan ia menjadi lagu dalam industri muzik itu sendiri. Ia masih muzik dan boleh dengar hari-hari.""Saya memang mahu tembusi pasaran arus perdana tanpa mengubah muzik saya. Saya jenis tradisional dan enggan bermain Sape kontemporari. Tapi saya terbuka saja kalau perlu adun dengan aspek seperti genre pop,"" katanya.Alena yang berketurunan Kelabit tahu pasti akan ada kesulitan namun perlahan-lahan menyuntik gabung gabungan. Dia juga bersyukur industri arus perdana semakin terbuka dengan lebih banyak instrumen tradisi sekarang.Menyatakan keterujaannya beraksi di Sounds of Borneo, dia mendedikasikan pencapaian itu kepada komuniti Sape yang teguh berjuang. Dia tidak sabar merasai sendiri keajaiban di pentas bersama MPO.""Ini sangat besar maknanya buat komuniti pejuang Sape untuk pergi sejauh ini. Ini kerana, di Sarawak sendiri pun masih ramai yang belum melihat Sape. Mungkin dengar dalam lagu saja selama ini.""Ada tekanan tapi teruja lebih. Saya percaya orkestra itu akan serikan lagi bunyi Sape itu nanti. Contohnya untuk lagu Gituan pasal bintang, saya bayangkan atmosferanya nanti akan seperti di awang-awangan,"" katanya.Dalam pada itu, Ketua Jabatan Perniagaan & Pengurusan Hubungan Strategik MPO, Effendy Khalid yakin persembahan Marsha, Velvet, dan Alena bakal tinggalkan impak tersendiri.""Melodi dan susunan orkestra yang klasik sudah menjadi kepakaran kami. Tapi untuk bawakan asimilasi begini, kami perlu tampil dengan susunan lebih megah m yang akan dipimpin oleh konduktor Luqman Aziz.  ""Saya percaya ia akan menjadi sebuah konsert yang hebat. Sudah menjadi impian kami untuk menyediakan platform begini buat semua jenis muzik dari Malaysia,"" katanya."
Arif Aiman ziarah Faisal Halim,https://www.hmetro.com.my/utama/2024/08/1127704/arif-aiman-ziarah-faisal-halim,Firdaus Hashim,153,"Kuala Lumpur: Selepas membantu Johor Darul Ta'zim (JDT) menjuarai Piala FA, Sabtu lalu, pemain sensasi negara, Arif Aiman Hanapi sempat menziarahi Faisal Halim di rumah rakan sepasukannya bersama skuad Harimau Malaya itu.Menerusi gambar yang dikongsikan di laman Story Instagram milik Arif Aiman, dia sempat menemui Faisal di rumah pemain Selangor FC itu.""Segera sembuh dan semoga dipermudah urusan Mickey (Faisal Halim),"" tulis Arif Aiman.Hantaran itu kemudiannya disambut Faisal yang turut menzahirkan ucapan terima kasih.""Terima kasih Messi (Arif Aiman) datang melawat dan bagi semangat. Selamat maju jaya untuk perlawanan nanti,"" kata Faisal.Ini adalah gambar pertama buat kedua-dua pemain itu sejak Faisal disimbah asid pada 5 Mei lalu.Sebelum ini, Faisal disimbah asid oleh dua individu tidak dikenali di sebuah pusat belah-belah hingga mengakibatkan pemain itu terpaksa menjalani pembedahan kulit sebanyak empat kali.Sehingga kini, penjenayah terbabit masih belum diberkas dan membuatkan penyokong ternanti-nanti mengenai perkembangan siasatan kes itu."
Tidak adil salahkan PSM kualiti padang SNBJ - Iliyas,https://www.hmetro.com.my/utama/2024/08/1127681/tidak-adil-salahkan-psm-kualiti-padang-snbj-iliyas,Firdaus Hashim,385,"Kuala Lumpur: Perbadanan Stadium Malaysia (PSM) menganggap tidak adil menyalahkan pihaknya mengenai keadaan padang di Stadium Nasional Bukit Jalil (SNBJ) ketika saingan Pestabola Merdeka 2024 masih berbaki lapan hari sebelum dilangsungkan pada 4 dan 8 September ini.Perkara itu disuarakan Ketua Pegawai Eksekutif PSM, Iliyas Jamil yang menegaskan pihaknya sentiasa memantau keadaan padang SNBJ sama ada sebelum, ketika atau selepas padang itu digunakan.Ujarnya, dakwaan negatif mengenai padang sebaik selesainya aksi final Piala FA antara Johor Darul Ta'zim (JDT) dan Selangor FC pada Sabtu lalu tidak boleh dijadikan ukuran dengan mengandaikan kemungkinan situasi sama boleh berlaku ketika saingan Pestabola Merdeka berlangsung nanti.Sebaliknya, Iliyas yakin pihaknya masih mempunyai masa untuk menyediakan padang yang sebaiknya sebelum saingan empat negara itu bermula.""Padang itu kita akan sediakan hingga minit terakhir, maknanya pada hari permainan pun kita terus buat kerja kita sampailah sebelum perlawanan.""Ketika perlawanan pun (waktu rehat), kita akan betulkan apa-apa yang perlu sepanjang perlawanan.""Untuk mengeluarkan kenyataan seperti ini, ketika masih ada lebih kurang lapan hari pada saya tak adillah,"" katanya ketika dihubungi Arena Metro, hari ini.Semalam, Persatuan Bolasepak Malaysia (FAM) melahirkan kebimbangan mengenai mutu dan kualiti padang menjelang sepak mula Pestabola Merdeka 2024, pada minggu hadapan.Kebimbangan itu diluahkan selepas aksi final Piala FA hujung minggu lalu yang menyaksikan JDT menang 6-1 ke atas Selangor FC.Dalam aksi itu, kelihatan ada beberapa bahagian di permukaan padang mudah tercabut serta di penjuru tepi yang tidak rata dan berpasir.Jelas Iliyas, beliau tidak bersetuju 100 peratus tentang andaian segelintir pihak yang mendakwa keadaan padang tidak sempurna boleh mendatangkan kecederaan kepada pemain.""Sebenarnya kat tengah padang itu dah 'OK' dah, cumanya di bahagian sudut sahaja masih ada kelemahan sikit.""Sebelum final pun saya sudah sebutkan dalam temuramah yang menyatakan di sudut ini memang kita ada masalah daripada reka bentuk stadium itu.""Kita cuba sediakan terbaik untuk perlawanan tapi untuk menyatakan kecederaan ini disebabkan oleh padang semata-mata tak berapa nak 'fair',"" katanya.Isu kualiti padang SNBJ bukan perkara baharu apabila hal berkenaan sering dibangkitkan berpuluh kali sejak beberapa tahun lalu.Ketika ini, padang SNBJ menggunakan rumput jenis Zeon Zoysia yang ditukar pada pertengahan tahun lalu dengan menggantikan rumput lama iaitu Cow Grass.Rumput baharu ini adalah kurniaan daripada pemilik JDT, Tunku Ismail Sultan Ibrahim apabila padang jenis ini pernah digunakan kelab itu di Stadium Larkin dan Stadium Sultan Ibrahim."
Dua anggota polis parah tertimbus tanah ketika musnah bom,https://www.hmetro.com.my/utama/2024/08/1127679/dua-anggota-polis-parah-tertimbus-tanah-ketika-musnah-bom,Mohamad Fahd Rahmat,150,"Kluang: Dua anggota polis cedera parah selepas tertimbus ketika menjalankan tugas pemusnahan bom di tapak perumahan Jalan Tabah, Taman Sri Lambak, di sini kira-kira 3 petang, hari ini.Susulan kejadian itu, dua anggota dari Ibu Pejabat Polis Kontinjen (IPK) Johor itu kini dimasukkan ke Unit Rawatan Rapi (ICU) Hospital Enche' Besar Hajjah Khalsom untuk rawatan kecemasan.Dua anggota daripada Unit Pemusnah Bom yang terbabit dalam kejadian itu dikenal pasti sebagai Koperal Abd Halim Zainal dan Koperal Muhammad Faruuqi Shamsary.Kedua-dua mangsa dipercayai cedera parah pada beberapa anggota badan.Ketua Polis Johor, Komisioner M Kumar, mengesahkan berlaku kejadian tanah runtuh terbabit tetapi enggan mengulas lanjut mengenainya.""Saya belum mempunyai butiran lanjut mengenai tahap kecederaan, tetapi saya boleh mengesahkan anggota polis yang terbabit dalam kejadian itu dikejarkan ke hospital,"" katanya ketika dihubungi media.Terdahulu, tular di media sosial mengenai kehadiran ambulans ke kawasan perumahan berkenaan hingga mengundang pertanyaan penduduk setempat"
'Saya ajar arwah isteri mengucap kalimah syahadah' - Suami,https://www.hmetro.com.my/utama/2024/08/1127580/saya-ajar-arwah-isteri-mengucap-kalimah-syahadah-suami,Alias Abd Rani,388,"Batu Pahat: ""Sayalah individu yang mengajar arwah mengucap kalimah syahadah,"" kata Tajudin Supaat, 56, suami kepada Allahyarham Fauziah Selamat, 46, yang maut dalam kemalangan di Kilometer (KM) 80, Jalan Johor Bahru-Ayer Hitam, dekat Renggam, semalam.Kemalangan berlaku ketika arwah dalam perjalanan dari rumahnya di Taman Melewar, Parit Raja, di sini, ke sekolah tempatnya mengajar di Sekolah Agama Bandar Renggam.Tajudin berkata, kira-kira 30 minit sebelum mendapat berita dukacita itu, arwah isterinya sempat menghubungi memaklumkan dia mahu bergerak ke sekolahnya kira-kira 12.15 tengah hari.Ketika itu, Tajudin yang dalam perjalanan ke Machap dengan harapan mahu berjumpa isterinya seketika sebelum arwah menyambung tugas sebagai Guru Penolong Kanan 1 di sekolah terbabit.""Sewaktu dalam perjalanan ke sana (Machap), hati saya sudah tidak sedap seolah-olah ada sesuatu tidak kena berlaku. Kemudian saya ternampak satu kemalangan dan dalam hati saya mengatakan seperti mengenali kenderaan itu.""Bila saya lihat nombor pendaftaran, barulah saya tahu isteri terbabit dalam kemalangan. Tanpa melengahkan masa, saya terus menerpa ke arahnya yang ketika itu sedang tersepit di tempat duduk pemandu.""Saya ajarnya mengucap walaupun ketika itu keadaannya sudah 50-50. Akhirnya, saya terdengar 'Allah, Allah', sebelum disahkan meninggal atas pangkuan saya. Hati saya berkata ikhlas, reda dan 'melepaskan' dia untuk selama-lamanya,"" katanya ketika ditemui di rumahnya di Taman Manis, Parit Raja, di sini, hari ini.Tajudin dalam nada suara tersekat-sekat memberitahu, dia beberapa kali mencuba untuk mengeluarkan isterinya, namun gagal kerana arwah tersepit di tempat duduk pemandu.""Saya ingatkan dapat jumpa dia sekejap di Machap, tapi sayangnya saya hanya jumpa dalam keadaan begitu. Paling menyedihkan pemergiannya ketika hanya tinggal tiga hari kami akan menyambut ulang tahun perkahwinan kelima.""Saya menikahinya pada 29 Ogos 2019, dia meninggal (dunia pada) 26 Ogos (semalam). Saya tidak dapat bayangkan perasaan ketika ini apabila insan tersayang pergi dalam sekelip mata.""Apa yang membanggakan ialah arwah tidak pernah meninggalkan wuduk setiap kali mahu ke sekolah. Kalau dia salam dengan saya, dia akan ambil wuduk dan terus ke sekolah, itulah rutin dilakukan setiap hari,"" katanya.Dalam pada itu, Tajudin berkata, arwah memohon untuk berpindah sekolah berdekatan rumah di Parit Raja beberapa kali, namun ditolak.Katanya, setiap hari, isterinya akan menempuh perjalanan pergi balik hampir 100 kilometer sejak lima tahun mengajar di sekolah terbabit.""Dia nak sangat pindah tapi belum ada rezeki, hari ini dia memang pindah ke sini untuk selama-lamanya,"" katanya sambil memberitahu jenazah isterinya disemadikan Tanah Perkuburan Islam Parit Raja pada 10 malam tadi."
'Apa kau buat dekat anak buah kami',https://www.hmetro.com.my/utama/2024/08/1127463/apa-kau-buat-dekat-anak-buah-kami,Muhaamad Hafis Nawawi,290,"Gombak: Bapa tiri dan ibu kandung didakwa di Mahkamah Majistret Selayang, hari ini, atas pertuduhan membunuh anak perempuan mereka berusia lapan tahun pada 17 Ogos lalu.  Tertuduh, Mohamad Zulhelmy Amirrudin, 29, bekerja sebagai pengawal keselamatan dan isterinya, Norfazira Radzi, 30, penjual aiskrim, mengangguk faham sejurus pertuduhan dibacakan jurubahasa di hadapan Majistret Chai Guan Hock.  Bagaimanapun, tiada pengakuan direkodkan kerana kes bunuh adalah di bawah bidang kuasa Mahkamah Tinggi.  Mengikut kertas pertuduhan, tertuduh didakwa mengikut Seksyen 302 Kanun Keseksaan iaitu mereka bersama-sama melakukan bunuh dengan menyebabkan kematian ke atas Nur Anissa Afiera Muhamad Zulhafize di pangsapuri Sandalwood Court, Bandar Tasik Puteri, Rawang, di sini, antara jam 11.51 pagi hingga jam 3.51 petang, 17 Ogos lalu.  Jika disabitkan mengikut Seksyen 302 Kanun Keseksaan, tertuduh boleh dihukum gantung sampai mati atau dipenjara minimum 30 tahun dan maksimum 40 tahun dan tidak kurang 12 sebatan.  Prosiding kes dikendalikan Timbalan Pendakwa Raya Nor Izairah Zainal manakala tertuduh tidak diwakili peguam.   Nor Izairah juga memohon mahkamah menetapkan tarikh sebutan baharu bagi mendapatkan laporan bedah siasat dan laporan kimia.  Mahkamah kemudian menetapkan tarikh sebutan semula kes pada 16 Oktober ini dan tidak membenarkan jaminan terhadap tertuduh.  Terdahulu, di luar mahkamah, sebaik kedua-dua tertuduh tiba, beberapa individu dipercayai ahli keluarga bapa kandung mangsa melaungkan takbir dan berteriak pembunuh.  ""Apa kau buat dekat anak buah kami...pembunuh, kami mahu keadilan,"" katanya.  Harian Metro sebelum ini melaporkan kanak-kanak perempuan berusia lapan tahun dipukul dengan tangan, kaki, tali pinggang, penyangkut baju dan senjata tumpul sehingga meninggal dunia.  Hasil siasatan mendapati, mangsa disahkan meninggal dunia di rumahnya oleh pembantu pegawai perubatan Hospital Sungai Buloh.  Pemeriksaan awal ke atas tubuh badan mangsa mendapati terdapat kesan kecederaan di bahagian muka, bibir, paha, dagu dan lutut.  Susulan itu, polis menahan bapa tiri dan ibu kandungnya di sebuah pangsapuri di Bandar Tasik Puteri, Rawang."
