title,url,author_name,word_count,body
"Zii Jia terima RM250,000, Aaron-Wooi Yik dapat RM100,000 seorang",https://www.hmetro.com.my/utama/2024/08/1125841/zii-jia-terima-rm250000-aaron-wooi-yik-dapat-rm100000-seorang,Amirul Fazli Zulkafli,297,"Kuala Lumpur: Durian runtuh buat pemenang pingat gangsa Sukan Olimpik Paris 2024, Aaron Chia-Soh Wooi Yik apabila bakal menerima insentif  Skim Hadiah Kemenangan Sukan (SHAKAM) berjumlah RM200,000. Ini bermakna, mereka bakal menerima RM100,000 setiap seorang dan itu pertama kali dalam sejarah SHAKAM memberikan hadiah sebanyak itu bagi acara berpasukan.  Menteri Belia dan Sukan, Hannah Yeoh berkata, Majlis Sukan Negara (MSN) mengambil keputusan untuk memberikan ganjaran itu kepada Aaron-Wooi Yik selepas melihat perih jerih serta pencapaian mereka di pentas Olimpik. Beliau berkata, mereka sudah berusaha keras untuk mengharumkan nama Malaysia di pentas dunia dan berjuang berhabis-habisan di Olimpik. ""Ini kali kedua Aaron-Wooi Yik membawa pulang pingat gangsa (Tokyo 2020 dan Paris 2024).  ""Jadi MSN memutuskan untuk memberi ganjaran RM100,000 setiap seorang kepada mereka tanpa perlu berkongsi,"" kata Hannah pada majlis penyerahan kenderaan utiliti sukan (SUV) Chery, di sini, hari ini.Hadir sama, Pengarah MSN, Abdul Rashid Yaakub dan Naib Presiden Chery Malaysia, Michael Chew. Selain itu, pemain perseorangan profesional negara, Lee Zii Jia yang memenangi pingat gangsa di Paris 2024 menerima ganjaran keseluruhan RM 250,000. ""Zii Jia diberikan geran RM50,000 sebelum Paris 2024 dan beliau akan menerima tambahan RM100,000 di bawah skim MSN. RM100,000 pula hadir menerusi hadiah SHAKAM.""Kami percaya bahawa sukan adalah alat penyatu untuk Malaysia. Kami menggalakkan sektor swasta untuk memainkan peranan mereka dalam memberi ganjaran kepada atlet apabila mereka membawa pulang pingat. ""Apa yang menjadikan tindakan Chery istimewa adalah mereka meraikan semua pemenang pingat,"" katanya. Untuk makluman, pemenang emas Sukan Olimpik akan menerima RM1 juta, perak (RM300,000) dan gangsa (RM100,000).Selain itu, mereka turut menerima Skim Imbuhan Tetap Olimpik berkuatkuasa bulan hadapan yang diberikan secara bulanan sepanjang hayat dengan pemenang emas diberikan RM5,000, perak RM3,000 dan gangsa bernilai RM2,000.Terdahulu, ketiga-ketiga atlet berkenaan menerima SUV Chery Tiggo 7 Pro bernilai RM123,800 yang diadakan di Puchong."
Fakrul Afizul atlet pertama pecah rekod kebangsaan olahraga,https://www.hmetro.com.my/utama/2024/08/1125819/fakrul-afizul-atlet-pertama-pecah-rekod-kebangsaan-olahraga,Helmi Talkah,140,"Kuching: Pelari 400 meter (m) lari berpagar negara, Muhammad Fakrul Afizul Nasir mencipta sensasi apabila menjadi atlet pertama yang memecahkan rekod kebangsaan dalam olahraga di Sukan Malaysia (Sukma) Sarawak 2024.Fakrul, 20, yang mewakili Kelantan cemerlang apabila merakam masa terpantas 51.11 saat (s) sekali gus memenangi pingat emas pada aksi final di Stadium Sarawak di sini, sebentar tadi. Catatan itu menyaksikan dia memperbaharui rekod kebangsaan miliknya 51.26s yang dilakukan ketika Kejohanan Olahraga Bawah 20 Tahun Asia di Yecheon, Korea Selatan pada 7 Jun tahun lalu. Pingat perak acara itu dimenangi atlet Johor, Muhammad Aiman Najmi Mohd Anuar (53.20s) manakala gangsa menjadi milik Emmanuel Muphy Josbert Wilayah Persekutuan (53.50s). Sementara itu, saingan wanita menyaksikan pelari Johor, Nur Shaqirah Cik Mat Kilau merangkul emas dengan catatan 63.36s diikuti Siti Nur Faqihah Saidi dari Kelantan meraih perak (63.44s) manakala atlet Sabah, Frenynila Sherly Lucius gangsa (64.22s)."
"Wak Doyok jadi mangsa tipu, rugi RM3 juta",https://www.hmetro.com.my/utama/2024/08/1125796/wak-doyok-jadi-mangsa-tipu-rugi-rm3-juta,Ramlah Zainal,275,"Shah Alam: Pelakon, ikon media sosial dan usahawan popular, Wak Doyok, 45, mendakwa menanggung kerugian lebih RM3 juta akibat ditipu rakan perniagaan syarikatnya.Wak Doyok atau nama sebenarnya Mohd Azwan Md Nor berkata, dia menyedari ditipu rakan perniagaannya yang juga pasangan suami isteri itu selepas membuat siasatan terhadapnya.""Hasil siasatan, saya dapati mereka terbabit dalam pemalsuan dokumen, salah guna kuasa, pecah amanah dan pengubahan wang haram.""Mereka juga sudah mengosongkan premis pejabat dan melarikan semua barangan dan peralatan milik syarikat tanpa pengetahuan saya.""Saya hanya dapat tahu dia sudah mengosongkan premis dan seramai 20 kakitangan juga sudah berhenti dari syarikat, baru-baru ini,"" katanya kepada Harian Metro ketika ditemui di pejabatnya di Bukit Jelutong, di sini, hari ini.Wak Doyok berkata, dia sedih dan kecewa kerana sudah melabur kira-kira RM500,000 dengan wang simpanannya untuk syarikat berkenaan.""Saya terpaksa jual tanah dan aset lain untuk melabur dalam perniagaan ini dan tidak sangka ditipu rakan perniagaan sendiri pula.""Saya sudah berusaha untuk berbincang secara baik untuk menyelesaikan kes ini tetapi pihak terbabit mendakwa dia ditipu dan mengambil tindakan undang-undang (saman) terhadap saya pula,"" katanya.Wak Doyok berkata, dia juga sudah membuat 10 laporan di Balai Polis Bukit Jelutong terhadap mereka sejak 2 Julai lalu.""Saya juga sudah mengambil khidmat peguam dan berharap semoga kebenaran akan berpihak kepada saya,"" katanya.Menurutnya, walaupun sedih dia tetap bangkit semula untuk meneruskan perniagaannya seperti biasa.""Saya sudah menceburi perniagaan baru sekarang. Sebenarnya, saya terpanggil untuk berkongsi kes penipuan ini untuk memberi kesedaran kepada masyarakat.""Semoga pendedahan ini akan sedikit sebanyak membantu rakan artis dan orang ramai supaya lebih berhati-hati untuk menjalankan perniagaan 'joint venture' kerana ia banyak membabitkan kegiatan 'scammer' ketika ini,"" katanya."
'Kenyang' dek habuan satu kepala RM3.5k,https://www.hmetro.com.my/utama/2024/08/1125667/kenyang-dek-habuan-satu-kepala-rm35k,,204,"Kuala Lumpur: Terima 'habuan' RM500 hingga RM3,500 bagi setiap 'kepala' warga asing yang dibantu melepasi pemeriksaan ketat di Lapangan Terbang Antarabangsa Kuala Lumpur (KLIA). Sumber Suruhanjaya Pencegahan Rasuah Malaysia (SPRM) berkata, jumlah bayaran lumayan itu diberikan sindiket kepada segelintir anggota penguatkuasa bertugas di KLIA. ""SPRM bagaimanapun berjaya membongkar perbuatan ini hasil risikan dan penyamaran dilakukan pegawai SPRM sejak beberapa bulan lalu. Menurutnya, tiada angka tetap berhubung jumlah habuan diberikan sindiket berikutan ia tidak membabitkan pemindahan wang ke akaun bank suspek, selain bilangan kemasukan warga asing yang berbeza setiap hari. ""Mungkin mereka 'belajar' dari 'kesilapan' suspek terdahulu yang pernah ditangkap SPRM dan didakwa di mahkamah. Sebelum ini ada antara pegawai JIM yang ditahan didapati menonjolkan kekayaan luar biasa dan deretan kereta mewah dimiliki. ""Ketika ini pegawai SPRM masih menjalankan siasatan di manakah wang habuan atau suapan diterima itu disembunyikan suspek,"" katanya semalam. Menurutnya, sehingga kelmarin, hanya wang tunai berjumlah puluhan ribu ringgit dipercayai wang sogokan  dirampas pegawai SPRM melalui operasi dilakukan. ""Ada kemungkinan suspek ditahan menggunakan proksi untuk menyimpan wang haram diterima daripada sindiket. Setakat ini SPRM masih jalankan siasatan dan yakin lebih banyak bukti dapat dibongkar,"" katanya. Menurutnya, kelima-lima pegawai imigresen lelaki yang ditahan  akan disoal siasat bagi mengetahui pembabitan mereka dalam jenayah berkenaan."
Pengkhianat 'setting counter',https://www.hmetro.com.my/utama/2024/08/1125655/pengkhianat-setting-counter,Mohd Jamilul Anbia Md Denin,441,"Kuala Lumpur: Entah kali ke berapa pintu masuk utama negara di Lapangan Terbang Antarabangsa Kuala Lumpur (KLIA) dibolosi pendatang asing!  Terbaru lima pegawai dan kakitangan Jabatan Imigresen Malaysia (JIM) diberkas sepasukan pegawai Suruhanjaya Pencegahan Rasuah Malaysia (SPRM) selepas disyaki menjadi 'tali barut' membawa masuk warga asing di negara ini. Dalam operasi bermula pagi kelmarin, SPRM menahan semua suspek dalam serbuan dilakukan di KLIA, pejabat JIM dan kediaman masing-masing.Kejayaan itu, sekali gus menjawab persoalan berhubung punca 'limpahan' kemasukan terlalu ramai warga asing Myanmar, Bangladesh, Indonesia, India, Pakistan serta Nepal ke Malaysia sejak kebelakangan ini. Risikan mendapati warga asing ini mampu melepasi pintu masuk negara tanpa pemeriksaan pihak berkuasa. Ia dilakukan menerusi modus operandi counter setting atau kaunter khas yang diatur sindiket dengan kerjaama suspek di KLIA. Ketua Pesuruhjaya SPRM, Tan Sri Azam Baki berkata, 12 individu membabitkan sembilan lelaki dan tiga wanita berusia 20 hingga 50-an ditahan menerusi operasi Op Pump dijalankan SPRM di sekitar Lembah Klang, Pulau Pinang dan Kelantan. Katanya, mereka yang ditahan membabitkan empat pemilik syarikat dan tiga orang awam dipercayai mempunyai peranan masing-masing mengurus kemasukan warga asing berkenaan serta lima penguat kuasa yang bertugas di Lapangan Terbang Antarabangsa Kuala Lumpur (KLIA) Terminal 2, Sepang. ""Tangkapan dilakukan ini susulan risikan dijalankan SPRM sejak 2022 terhadap kegiatan sindiket ini yang bersekongkol dengan pegawai sebuah agensi penguat kuasa. ""Sindiket ini dipercayai meraih keuntungan jutaan ringgit dan siasatan dijalankan mengesan ada kemasukan wang lebih RM4 juta dari 2022 hingga 2024 dipercayai bagi urusan kemasukan warga asing yang turut diagih kepada penguat kuasa terbabit,"" katanya. Beliau berkata, modus operandi kegiatan sindiket ini dengan membuat counter setting (kaunter khas) iaitu bersekongkol dengan penguat kuasa di pintu masuk negara yang sedia menunggu di beberapa kaunter tertentu bagi memudahkan kemasukan kumpulan warga asing berkenaan. Katanya, kumpulan warga asing ingin masuk ke negara ini akan menghubungi ejen mengurus tiket penerbangan termasuk urusan dengan penguat kuasa terlibat. ""Ejen  memberi maklumat kumpulan warga asing terbabit kepada penguat kuasa yang sudah menunggu di kaunter tertentu dan pada masa sama  memaklumkan kepada warga asing untuk pergi ke kaunter terbabit sebaik tiba di negara ini bagi membolehkan mereka dilepaskan tanpa pemeriksaan sepatutnya. ""Sebaik melepasi kaunter khas, kumpulan warga asing terbabit  diambil wakil ejen yang berperanan membawa mereka keluar ke destinasi tertentu,"" katanya.Kumpulan warga asing ini sepatutnya melalui pemeriksaan berdasarkan Pekeliling Imigresen Bilangan 4 Tahun 2021 iaitu mereka perlu kemukakan pasport atau dokumen yang sah, mempunyai visa, mempunyai tiket perjalanan pergi balik yang sah, ada wang sara diri mencukupi sepanjang berada di negara, perlu tunjukkan alamat penginapan atau bukti tempahan hotel. Tambahnya  menerusi kaunter khas ini, mereka dilepaskan  tanpa melalui pemeriksaan sepatutnya. Beliau berkata, semua suspek dibawa ke Mahkamah Majistret Putrajaya bagi proses permohonan reman semalam."
Pengkhianat 'setting counter',https://www.hmetro.com.my/utama/2024/08/1125655/pengkhianat-setting-counter,Mohd Jamilul Anbia Md Denin,441,"Kuala Lumpur: Entah kali ke berapa pintu masuk utama negara di Lapangan Terbang Antarabangsa Kuala Lumpur (KLIA) dibolosi pendatang asing!  Terbaru lima pegawai dan kakitangan Jabatan Imigresen Malaysia (JIM) diberkas sepasukan pegawai Suruhanjaya Pencegahan Rasuah Malaysia (SPRM) selepas disyaki menjadi 'tali barut' membawa masuk warga asing di negara ini. Dalam operasi bermula pagi kelmarin, SPRM menahan semua suspek dalam serbuan dilakukan di KLIA, pejabat JIM dan kediaman masing-masing.Kejayaan itu, sekali gus menjawab persoalan berhubung punca 'limpahan' kemasukan terlalu ramai warga asing Myanmar, Bangladesh, Indonesia, India, Pakistan serta Nepal ke Malaysia sejak kebelakangan ini. Risikan mendapati warga asing ini mampu melepasi pintu masuk negara tanpa pemeriksaan pihak berkuasa. Ia dilakukan menerusi modus operandi counter setting atau kaunter khas yang diatur sindiket dengan kerjaama suspek di KLIA. Ketua Pesuruhjaya SPRM, Tan Sri Azam Baki berkata, 12 individu membabitkan sembilan lelaki dan tiga wanita berusia 20 hingga 50-an ditahan menerusi operasi Op Pump dijalankan SPRM di sekitar Lembah Klang, Pulau Pinang dan Kelantan. Katanya, mereka yang ditahan membabitkan empat pemilik syarikat dan tiga orang awam dipercayai mempunyai peranan masing-masing mengurus kemasukan warga asing berkenaan serta lima penguat kuasa yang bertugas di Lapangan Terbang Antarabangsa Kuala Lumpur (KLIA) Terminal 2, Sepang. ""Tangkapan dilakukan ini susulan risikan dijalankan SPRM sejak 2022 terhadap kegiatan sindiket ini yang bersekongkol dengan pegawai sebuah agensi penguat kuasa. ""Sindiket ini dipercayai meraih keuntungan jutaan ringgit dan siasatan dijalankan mengesan ada kemasukan wang lebih RM4 juta dari 2022 hingga 2024 dipercayai bagi urusan kemasukan warga asing yang turut diagih kepada penguat kuasa terbabit,"" katanya. Beliau berkata, modus operandi kegiatan sindiket ini dengan membuat counter setting (kaunter khas) iaitu bersekongkol dengan penguat kuasa di pintu masuk negara yang sedia menunggu di beberapa kaunter tertentu bagi memudahkan kemasukan kumpulan warga asing berkenaan. Katanya, kumpulan warga asing ingin masuk ke negara ini akan menghubungi ejen mengurus tiket penerbangan termasuk urusan dengan penguat kuasa terlibat. ""Ejen  memberi maklumat kumpulan warga asing terbabit kepada penguat kuasa yang sudah menunggu di kaunter tertentu dan pada masa sama  memaklumkan kepada warga asing untuk pergi ke kaunter terbabit sebaik tiba di negara ini bagi membolehkan mereka dilepaskan tanpa pemeriksaan sepatutnya. ""Sebaik melepasi kaunter khas, kumpulan warga asing terbabit  diambil wakil ejen yang berperanan membawa mereka keluar ke destinasi tertentu,"" katanya.Kumpulan warga asing ini sepatutnya melalui pemeriksaan berdasarkan Pekeliling Imigresen Bilangan 4 Tahun 2021 iaitu mereka perlu kemukakan pasport atau dokumen yang sah, mempunyai visa, mempunyai tiket perjalanan pergi balik yang sah, ada wang sara diri mencukupi sepanjang berada di negara, perlu tunjukkan alamat penginapan atau bukti tempahan hotel. Tambahnya  menerusi kaunter khas ini, mereka dilepaskan  tanpa melalui pemeriksaan sepatutnya. Beliau berkata, semua suspek dibawa ke Mahkamah Majistret Putrajaya bagi proses permohonan reman semalam."
"Yasin dipenjara seumur hidup, 16 sebatan",https://www.hmetro.com.my/utama/2024/08/1125651/yasin-dipenjara-seumur-hidup-16-sebatan,Suraya Roslan,343,"Shah Alam: Komposer dan penyanyi terkenal, Yasin Sulaiman dijatuhi hukuman penjara seumur hidup dan 16 sebatan oleh Mahkamah Tinggi di sini, hari ini selepas didapati bersalah atas tiga pertuduhan dadah dihadapinya, dua tahun lalu.  Hakim Datuk Norsharidah Awang menjatuhkan hukuman itu selepas membenarkan rayuan pendakwaan selaku perayu ke atas keputusan Hakim Mahkamah Sesyen Petaling Jaya, Faiz Dziyauddin yang melepas dan membebaskan pelantun lagu Mimpi Laila itu. Yasin atau nama sebenarnya Muhammad Yasin Sulaiman, 48, yang sebelum ini ditempatkan di Hospital Bahagia Ulu Kinta, Perak selama mana tempoh yang diperkenankan Sultan Selangor digari oleh pihak polis dan dibawa terus ke Penjara Kajang.""Hari ini hari yang gelap untuk saya,"" kata Yasin sebaik dibawa polis.  Pendakwaan dikendalikan Timbalan Pendakwa Raya Raja Zaizul Faridah Raja Zaharudin dan Ahmad Zuhaini Mahamad Amin manakala peguam Ariff Azami Hussein mewakili Yasin.Mengikut pertuduhan pertama yang baharu, Yasin didakwa dalam milikannya dadah berbahaya jenis Kanabis seberat 193.7 gram di sebuah kondominium di Persiaran Surian Damansara Indah Resort Home, PJU 3, Kota Damansara di sini jam 5.30 petang, 24 Mac 2022.Bagi kesalahan itu, Yasin didakwa mengikut Seksyen 6 Akta Dadah Berbahaya 1952 dan boleh dihukum dibawah Seksyen 39A(2) akta sama yang memperuntukkan hukuman penjara seumur hidup atau tidak kurang lima tahun dan juga boleh dikenakan hukuman sebat tidak kurang 10 sebatan jika sabit kesalahan.Pertuduhan kedua, Yasin didakwa menanam 17 pokok dalam pasu plastik berisi tanah yang mana daripadanya Kanabis yang diperolehi secara terus atau tidak langsung pada tempat, waktu dan tarikh sama yang mana pertuduhan itu mengikut Seksyen 6B(1)(a) Akta Dadah Berbahaya 1952 yang boleh dihukum di bawah Seksyen 6B(3) akta sama.Hukuman bagi seksyen memperuntukkan penjara seumur hidup dan sebatan tidak kurang daripada enam kali jika sabit kesalahan.Pertuduhan ketiga Yasin didakwa memberikan dirinya dadah berbahaya jenis '11-nor-delta-9 tetrahydrocannabinol-9- carboxylic acid' di Pejabat Narkotik Ibu Pejabat Daerah (IPD) Petaling Jaya, jam 11.05 malam pada tarikh sama.Bagi kesalahan itu pertuduhan dikemukakan di bawah Seksyen 15 (1)(a) Akta Dadah Berbahaya (ADB) 1952 dan boleh dihukum di bawah Seksyen 15 (1) akta yang sama, yang membawa hukuman denda tidak lebih RM5,000 atau dikenakan penjara maksimum dua tahun, jika sabit kesalahan."
Ayuh terjemah merdeka!,https://www.hmetro.com.my/utama/2024/08/1125572/ayuh-terjemah-merdeka,Sudirman Mohd Tahir,543,"Kuala Lumpur: ""Saya bangga menjadi anak Malaysia!"" Itu kata-kata penuh semangat peguam terkenal Datuk Ahmad Zaharil Muhaiyar, 58, ketika mengekspresikan makna kemerdekaan negara yang memasuki tahun ke 67, 31 Ogos ini. Ahmad Zaharil yang kisahnya tular kerana menyelamatkan wanita daripada dipenjara kerana mencuri kotak pensil untuk anaknya 26 tahun lalu, menyifatkan kemerdekaan yang dinikmati hari ini juga harus diterjemahkan dalam jati diri setiap rakyat Malaysia. Menurutnya, tidak ada erti kemerdekaan sekiranya dalam diri seseorang individu itu masih 'diperangkap' dengan budaya dan anasir luar sehingga pada akhirnya menghakis nilai dan adat sebenar bangsa yang merdeka. ""Diakui budaya luar serta elemen-elemen asing yang diperoleh secara berfasa, mengikis dan merosakkan nilai-nilai asal serta adat istiadat yang menjadi ciri hakiki bangsa Melayu yang sudah mencapai kemerdekaan.  ""Oleh itu, adalah sangat penting bagi setiap individu untuk memahami kepentingan mempertahankan identiti dan jati diri kebudayaan sendiri, agar nilai-nilai warisan nenek moyang kita tidak hilang ditelan zaman. ""Hanya dengan memahami dan menghargai warisan budaya dan adat istiadat yang diwarisi daripada generasi ke generasi, barulah kita mampu melindungi dan menghidupkan semula keaslian serta keunikan budaya Melayu yang sudah lama terpinggir oleh arus globalisasi dan pengaruh luar,"" katanya kepada Harian Metro. Ahmad Zaharil berkata, kesedaran terhadap nilai kebudayaan tempatan juga penting dalam mengekalkan semangat patriotik dan kesetiaan kepada negara, sekali gus asas dalam memperkuat perpaduan dan hidup harmoni dalam masyarakat majmuk.  Beliau yang sudah 32 tahun berkhidmat sebagai peguam berkata, hanya dengan jati diri yang kuat sahaja mampu menjadikan kita kekal sebagai sebuah negara yang berdaulat dan dihormati di mata dunia. Katanya, pemimpin yang ada pada hari ini memikul satu lagi tanggungjawab yang besar dalam usaha untuk terus memartabatkan bangsa dan negara di tengah-tengah krisis global yang semakin tidak menentu. ""Secara peribadi, saya masih tercari-cari identiti Malaysia dalam diri, termasuk dalam kalangan generasi muda hari ini. Mungkin kenyataan saya ini tidak disukai segelintir pihak, tapi ia adalah realiti yang perlu dihadapi. ""Bagi saya, terdapat banyak aspek yang perlu ditekankan dan dipelajari dengan lebih mendalam. Perkara paling utama bagi saya adalah mengajukan soalan kepada diri sendiri, adakah aku benar-benar berada merdeka?  ""Bagi saya, adalah penting untuk memahami signifikasi sebenar di sebalik kemerdekaan yang kita sambut hari ini. Ia bukan sekadar mengenai kemerdekaan daripada penjajahan asing, tetapi lebih kepada kebebasan dari batasan-batasan dalaman yang mungkin kita hadapi,"" katanya. Beliau berkata, penting untuk memulakan pembentukan jati diri dari rumah dan didikan sedari anak kecil lagi. ""Negara dan diri kita mungkin merdeka, tapi minda kita adakah sudah merdeka sepenuhnya? Kita masih agungkan budaya barat, walaupun kita ada identiti dan cita rasa tersendiri. ""Sebagai contoh, kebanyakan ibu bapa hari ini lebih selesa mengajar anak mereka bertutur dalam bahasa Inggeris. Baik ketika berada di pasar raya atau pulang kampung berhari raya, inilah situasinya. Apa sudah jadi dengan bahasa Melayu?"" katanya  Menurutnya, kesemua lima anaknya diajar bertutur dalam bahasa Melayu sejak dari kecil dan bahasa asing hanya akan dipelajari mereka apabila melalui proses pembelajaran. ""Alhamdulillah, biarpun mereka semua lulusan luar negara, bahasa ibunda mereka dengan loghat Perak itu kekal ada. Jadi, setiap nilai, norma, dan pola pikir yang ditanamkan sejak awal akan membentuk karakter yang akan menuntun individu dalam menjalani kehidupan. Itulah pentingnya peranan orang tua serta keluarga dalam menyediakan persekitaran yang mendukung perkembangan positif anak, sehingga ia mampu memahami dan mengenali dirinya dengan baik,"" katanya."
Anak seni hargai ilmu,https://www.hmetro.com.my/utama/2024/08/1125543/anak-seni-hargai-ilmu,Norhayati Nordin,510,"Setiap orang ada pilihan kehidupan masing-masing yang diimpikan mereka meskipun mungkin belum cukup dewasa untuk membuat keputusan dan memerlukan bimbingan ibu bapa.Bagi pelakon, penyanyi dan pempengaruh remaja, Alyssa Dezek, 16, ilmu pendidikan lebih penting untuk diutamakan pada usia muda ini demi jaminan masa depan yang terbaik.""Saya memang utamakan pelajaran dan ingin berjaya dengan keputusan terbaik dalam SPM (Sijil Pelajaran Malaysia) nanti dan tak boleh main-main dari sekarang.""Walaupun sangat sibuk dengan aktiviti seni dan penggambaran, saya tetap cari masa belajar dan memilih untuk terus menimba ilmu di sekolah walaupun bersekolah swasta.""Belajar di sekolah bagi saya lebih menyeronokkan kerana ada rakan-rakan yang boleh membantu untuk nota pelajaran dan sebagainya jika saya tidak hadir kerana terikat dengan kerja,"" katanya.Alyssa yang kini mengikuti aliran perakaunan berkata, dia ingin menjadi anak seni berilmu sekalipun pembabitannya dalam industri hiburan tanah air sejak kanak-kanak pada usia empat tahun kerana minat.""Menjadi artis yang berilmu sangat penting supaya kita lebih dihormati kerana bagi saya sekarang, apa pun yang dilakukan, kita mesti ada ilmu. Jangan sesekali tinggalkan ilmu sebab tak minat.""Untuk saya pun, apa cita-cita diimpikan mesti 'go with the flow' dengan berbekalkan ilmu yang sudah ditimba ketika kanak-kanak hingga remaja ini dengan misi hidup tersendiri,"" katanya.Ditanya juga pandangannya terhadap anak muda yang sanggup berhenti belajar kerana menjadi pempengaruh (influencer), Alyssa berkata, dia hanya dapat menekankan betapa pentingnya ada ilmu dalam diri.""Tidak salah pun kalau nak jadi 'influencer' di media sosial untuk menjana pendapatan, tapi biar ada ilmu dan bijak. Ini kerana, apabila ada ilmu kita jadi lebih kreatif dan proaktif mencari idea baharu.""Saya tahu sekarang ini pun ramai yang pilih jadi 'influencer' dan tinggalkan pelajaran. Tapi, tak bagus sebab macam saya cakap ilmu itu penting. Apabila masih berpeluang (timba ilmu), jangan dilepaskan,"" ujarnya. Pemilik nama sebenar, Aryanna Alyssa Dezek ini menduduki SPM tahun depan, namun sudah membuat persediaan dari sekarang dengan mengikuti kelas bimbingan pelajaran bersama pusat tuisyen bertauliah.Katanya, dia sudah bermula mempersiapkan diri menghadapi SPM berikutan yakin 'kejayaan tak datang bergolek tanpa usaha', termasuk 'kejayaan tidak akan mengkhianati usaha'.Tiada layanan istimewaApabila menjadi selebriti dikenali ramai, semestinya ia petanda baik buat Alyssa untuk mendapatkan 'layanan istimewa' daripada semua orang ketika dia berada di sekolah.Alyssa berkata, semua pelajar di sekolahnya dilayan sama rata oleh tenaga pengajar tanpa memandang siapa mereka, pekerjaan dan status keluarga kerana bertindak adil.""Di sekolah, saya tidak dilayan seperti artis. Masih ingat ketika mula-mula masuk (sekolah), saya beranggapan mungkin dilayan sedikit berbeza dengan orang lain, namun itu tidak berlaku.""Saya juga membayangkan tidak ada seorang pun yang mahu berkawan dengan saya. Tapi, tidak sangka juga saya ada ramai kawan dan mereka selalu bantu saya dalam pelajaran,"" katanya.Dalam perkembangan lain, difahamkan Alyssa kini tersenarai antara lima YouTuber paling berjaya di Malaysia dengan jumlah 4.7 juta pengikut di YouTube, manakala di Instagram pula dia memiliki kira-kira 2.6 juta pengikut.Alyssa kini mempunyai enam single solo sudah dilancarkan dalam nyanyiannya, termasuk untuk lakonan pula menerusi drama Patahnya Sebelah Sayap, Selafaz Cinta, Jodoh-Jodoh Annisa, Skuad Detektif KBAT dan Cinta Untuk Sekali Lagi."
Chen Jie bidik emas ketujuh menembak Sukma,https://www.hmetro.com.my/utama/2024/08/1125463/chen-jie-bidik-emas-ketujuh-menembak-sukma,Syazwan Msar,177,"Kuching: Ratu menembak Negeri Sembilan, Gan Chen Jie melengkapkan hari indah di Bumi Kenyalang apabila membawa pulang emas ketujuh dengan memenangi acara 10 meter (m) rifle udara campuran di Lapang Sasar Menembak, Petra Jaya, sebentar tadi.Cheng Jie bersama pasangannya Amar Syawal Abdul Mutalib mengesahkan pingat emas selepas menundukkan wakil Pahang, Nabila Aisya Rahman Abdullah dan Amar Syawal Abdul Mutalib menerusi keputusan 16-12.Pingat gangsa milik wakil Negeri Sembilan, Tan Yee Xuan-Muhammad Azman Mohd Ridzuan selepas menewaskan peserta Perlis Nur Aina Sofea Azi-Muhammad Ariff Naim Ariff Nazir (16-12).Sebelum itu, Chen Jie yang juga penuntut kolej swasta memenangi emas menerusi acara rifle udara 10m wanita individu dan berpasukan.Dia turut membawa pulang emas untuk kategori 50m tiga posisi individu dan berpasukan selain turut memenangi 10m rifle udara individu serta berpasukan.Chen Jie yang kemungkinan membawa pulang RM24,000 hasil kemenangan itu akan menyerahkan wang terbabit kepada keluarga untuk diuruskan kelak.""Wang kemenangan itu saya serahkan kepada keluarga kerana mungkin mereka lebih mengetahui untuk membeli keperluan seperti peralatan menembak atau kegunaan lain,"" kata atlet berusia 20 tahun itu."
